{
  "legislative_session": "2025",
  "identifier": "SB974",
  "title": "AN ACT RELATING TO LABOR AND LABOR RELATIONS -- TEMPORARY DISABILITY INSURANCE --CONTRIBUTIONS",
  "from_organization": "~{\"classification\": \"upper\"}",
  "classification": [
    "bill"
  ],
  "subject": [],
  "abstracts": [
    {
      "note": "summary",
      "abstract": "Increases the taxable wage base for TDI claims from $38,000 to $100,000 or the annual earnings needed by an individual to qualify for the maximum weekly benefit amount and the maximum duration under chapters 39 through 41 of this title."
    }
  ],
  "other_titles": [],
  "other_identifiers": [],
  "actions": [
    {
      "description": "04/16/2025 Introduced, referred to Senate Finance",
      "date": "2025-04-16",
      "organization_id": "~{\"classification\": \"upper\"}",
      "classification": [
        "introduction",
        "referral-committee"
      ],
      "related_entities": [],
      "_processing": {
        "log_file_created": "2025-11-26T03:05:01Z"
      }
    },
    {
      "description": "05/09/2025 Scheduled for hearing and/or consideration  (05/15/2025)",
      "date": "2025-05-09",
      "organization_id": "~{\"classification\": \"legislature\"}",
      "classification": [],
      "related_entities": [],
      "_processing": {
        "log_file_created": "2025-11-26T03:05:01Z"
      }
    },
    {
      "description": "05/15/2025 Committee recommended measure be held for further study",
      "date": "2025-05-15",
      "organization_id": "~{\"classification\": \"legislature\"}",
      "classification": [
        "committee-failure"
      ],
      "related_entities": [],
      "_processing": {
        "log_file_created": "2025-11-26T03:05:01Z"
      }
    },
    {
      "description": "06/03/2025 Scheduled for consideration  (06/05/2025)",
      "date": "2025-06-03",
      "organization_id": "~{\"classification\": \"legislature\"}",
      "classification": [],
      "related_entities": [],
      "_processing": {
        "log_file_created": "2025-11-26T03:05:01Z"
      }
    },
    {
      "description": "06/05/2025 Committee recommends passage",
      "date": "2025-06-05",
      "organization_id": "~{\"classification\": \"legislature\"}",
      "classification": [
        "committee-passage-favorable"
      ],
      "related_entities": [],
      "_processing": {
        "log_file_created": "2025-11-26T03:05:01Z"
      }
    },
    {
      "description": "06/05/2025 Placed on Senate Calendar  (06/12/2025)",
      "date": "2025-06-05",
      "organization_id": "~{\"classification\": \"upper\"}",
      "classification": [
        "reading-3"
      ],
      "related_entities": [],
      "_processing": {
        "log_file_created": "2025-11-26T03:05:01Z"
      }
    },
    {
      "description": "06/12/2025 Senate passed as amended (floor amendment)",
      "date": "2025-06-12",
      "organization_id": "~{\"classification\": \"upper\"}",
      "classification": [
        "passage"
      ],
      "related_entities": [],
      "_processing": {
        "log_file_created": "2025-11-26T03:05:01Z"
      }
    },
    {
      "description": "06/18/2025 Placed on House Calendar  (06/20/2025)",
      "date": "2025-06-18",
      "organization_id": "~{\"classification\": \"lower\"}",
      "classification": [
        "reading-3"
      ],
      "related_entities": [],
      "_processing": {
        "log_file_created": "2025-11-26T03:05:01Z"
      }
    },
    {
      "description": "06/20/2025 House passed as amended (floor amendment)",
      "date": "2025-06-20",
      "organization_id": "~{\"classification\": \"lower\"}",
      "classification": [
        "passage"
      ],
      "related_entities": [],
      "_processing": {
        "log_file_created": "2025-11-26T03:05:01Z"
      }
    },
    {
      "description": "06/20/2025 Placed on Senate Calendar  (06/20/2025)",
      "date": "2025-06-20",
      "organization_id": "~{\"classification\": \"upper\"}",
      "classification": [
        "reading-3"
      ],
      "related_entities": [],
      "_processing": {
        "log_file_created": "2025-11-26T03:05:01Z"
      }
    },
    {
      "description": "06/20/2025 Senate passed as amended in concurrence",
      "date": "2025-06-20",
      "organization_id": "~{\"classification\": \"upper\"}",
      "classification": [
        "passage"
      ],
      "related_entities": [],
      "_processing": {
        "log_file_created": "2025-11-26T03:05:01Z"
      }
    },
    {
      "description": "06/23/2025 Transmitted to Governor",
      "date": "2025-06-23",
      "organization_id": "~{\"classification\": \"executive\"}",
      "classification": [
        "executive-receipt"
      ],
      "related_entities": [],
      "_processing": {
        "log_file_created": "2025-11-26T03:05:01Z"
      }
    },
    {
      "description": "06/26/2025 Signed by Governor",
      "date": "2025-06-26",
      "organization_id": "~{\"classification\": \"executive\"}",
      "classification": [
        "executive-signature"
      ],
      "related_entities": [],
      "_processing": {
        "log_file_created": "2025-11-26T03:05:01Z"
      }
    }
  ],
  "sponsorships": [
    {
      "name": "Lawson",
      "classification": "primary",
      "entity_type": "person",
      "primary": true,
      "person_id": "~{\"name\": \"Lawson\"}",
      "organization_id": null
    },
    {
      "name": "Bissaillon",
      "classification": "primary",
      "entity_type": "person",
      "primary": true,
      "person_id": "~{\"name\": \"Bissaillon\"}",
      "organization_id": null
    },
    {
      "name": "Tikoian",
      "classification": "primary",
      "entity_type": "person",
      "primary": true,
      "person_id": "~{\"name\": \"Tikoian\"}",
      "organization_id": null
    },
    {
      "name": "Lauria",
      "classification": "primary",
      "entity_type": "person",
      "primary": true,
      "person_id": "~{\"name\": \"Lauria\"}",
      "organization_id": null
    },
    {
      "name": "DiMario",
      "classification": "primary",
      "entity_type": "person",
      "primary": true,
      "person_id": "~{\"name\": \"DiMario\"}",
      "organization_id": null
    },
    {
      "name": "Euer",
      "classification": "primary",
      "entity_type": "person",
      "primary": true,
      "person_id": "~{\"name\": \"Euer\"}",
      "organization_id": null
    },
    {
      "name": "Urso",
      "classification": "primary",
      "entity_type": "person",
      "primary": true,
      "person_id": "~{\"name\": \"Urso\"}",
      "organization_id": null
    },
    {
      "name": "Felag",
      "classification": "primary",
      "entity_type": "person",
      "primary": true,
      "person_id": "~{\"name\": \"Felag\"}",
      "organization_id": null
    },
    {
      "name": "Murray",
      "classification": "primary",
      "entity_type": "person",
      "primary": true,
      "person_id": "~{\"name\": \"Murray\"}",
      "organization_id": null
    },
    {
      "name": "Gallo",
      "classification": "primary",
      "entity_type": "person",
      "primary": true,
      "person_id": "~{\"name\": \"Gallo\"}",
      "organization_id": null
    }
  ],
  "related_bills": [],
  "versions": [
    {
      "note": "974\u00a0\u00a0as amended",
      "links": [
        {
          "url": "http://webserver.rilegislature.gov/BillText/BillText25/SenateText25/S0974aa.pdf",
          "media_type": "application/pdf"
        }
      ],
      "date": "",
      "classification": ""
    }
  ],
  "documents": [],
  "citations": [],
  "sources": [
    {
      "url": "https://status.rilegislature.gov/",
      "note": ""
    }
  ],
  "extras": {},
  "jurisdiction": {
    "id": "ocd-jurisdiction/country:us/state:ri/government",
    "name": "Rhode Island",
    "classification": "state",
    "division_id": "ocd-division/country:us/state:ri"
  },
  "_processing": {
    "logs_latest_update": "2025-11-26T03:05:01Z"
  }
}