{
  "legislative_session": "2025",
  "identifier": "SB829",
  "title": "AN ACT RELATING TO LABOR AND LABOR RELATIONS -- TEMPORARY DISABILITY INSURANCE -- BENEFITS",
  "from_organization": "~{\"classification\": \"upper\"}",
  "classification": [
    "bill"
  ],
  "subject": [],
  "abstracts": [
    {
      "note": "summary",
      "abstract": "Provides temporary caregivers benefits to any eligible bone marrow transplant donor or living organ donor and would provide definitions for both"
    }
  ],
  "other_titles": [],
  "other_identifiers": [],
  "actions": [
    {
      "description": "03/14/2025 Introduced, referred to Senate Labor and Gaming",
      "date": "2025-03-14",
      "organization_id": "~{\"classification\": \"upper\"}",
      "classification": [
        "introduction",
        "referral-committee"
      ],
      "related_entities": [],
      "_processing": {
        "log_file_created": "2025-11-26T03:04:58Z"
      }
    },
    {
      "description": "03/28/2025 Scheduled for hearing and/or consideration  (04/02/2025)",
      "date": "2025-03-28",
      "organization_id": "~{\"classification\": \"legislature\"}",
      "classification": [],
      "related_entities": [],
      "_processing": {
        "log_file_created": "2025-11-26T03:04:58Z"
      }
    },
    {
      "description": "04/02/2025 Committee recommended measure be held for further study",
      "date": "2025-04-02",
      "organization_id": "~{\"classification\": \"legislature\"}",
      "classification": [
        "committee-failure"
      ],
      "related_entities": [],
      "_processing": {
        "log_file_created": "2025-11-26T03:04:58Z"
      }
    },
    {
      "description": "06/01/2025 Scheduled for consideration  (06/04/2025)",
      "date": "2025-06-01",
      "organization_id": "~{\"classification\": \"legislature\"}",
      "classification": [],
      "related_entities": [],
      "_processing": {
        "log_file_created": "2025-11-26T03:04:58Z"
      }
    },
    {
      "description": "06/03/2025 Proposed Substitute",
      "date": "2025-06-03",
      "organization_id": "~{\"classification\": \"legislature\"}",
      "classification": [
        "substitution"
      ],
      "related_entities": [],
      "_processing": {
        "log_file_created": "2025-11-26T03:04:58Z"
      }
    },
    {
      "description": "06/04/2025 Committee recommends passage of Sub A",
      "date": "2025-06-04",
      "organization_id": "~{\"classification\": \"legislature\"}",
      "classification": [
        "committee-passage-favorable"
      ],
      "related_entities": [],
      "_processing": {
        "log_file_created": "2025-11-26T03:04:58Z"
      }
    },
    {
      "description": "06/05/2025 Placed on Senate Calendar  (06/10/2025)",
      "date": "2025-06-05",
      "organization_id": "~{\"classification\": \"upper\"}",
      "classification": [
        "reading-3"
      ],
      "related_entities": [],
      "_processing": {
        "log_file_created": "2025-11-26T03:04:58Z"
      }
    },
    {
      "description": "06/10/2025 Senate passed Sub A",
      "date": "2025-06-10",
      "organization_id": "~{\"classification\": \"upper\"}",
      "classification": [
        "passage"
      ],
      "related_entities": [],
      "_processing": {
        "log_file_created": "2025-11-26T03:04:58Z"
      }
    },
    {
      "description": "06/19/2025 Placed on House Calendar  (06/20/2025)",
      "date": "2025-06-19",
      "organization_id": "~{\"classification\": \"lower\"}",
      "classification": [
        "reading-3"
      ],
      "related_entities": [],
      "_processing": {
        "log_file_created": "2025-11-26T03:04:58Z"
      }
    },
    {
      "description": "06/20/2025 House passed Sub A in concurrence",
      "date": "2025-06-20",
      "organization_id": "~{\"classification\": \"lower\"}",
      "classification": [
        "passage"
      ],
      "related_entities": [],
      "_processing": {
        "log_file_created": "2025-11-26T03:04:58Z"
      }
    },
    {
      "description": "06/25/2025 Transmitted to Governor",
      "date": "2025-06-25",
      "organization_id": "~{\"classification\": \"executive\"}",
      "classification": [
        "executive-receipt"
      ],
      "related_entities": [],
      "_processing": {
        "log_file_created": "2025-11-26T03:04:58Z"
      }
    },
    {
      "description": "07/01/2025 Signed by Governor",
      "date": "2025-07-01",
      "organization_id": "~{\"classification\": \"executive\"}",
      "classification": [
        "executive-signature"
      ],
      "related_entities": [],
      "_processing": {
        "log_file_created": "2025-11-26T03:04:58Z"
      }
    }
  ],
  "sponsorships": [
    {
      "name": "Murray",
      "classification": "primary",
      "entity_type": "person",
      "primary": true,
      "person_id": "~{\"name\": \"Murray\"}",
      "organization_id": null
    },
    {
      "name": "Thompson",
      "classification": "primary",
      "entity_type": "person",
      "primary": true,
      "person_id": "~{\"name\": \"Thompson\"}",
      "organization_id": null
    },
    {
      "name": "Sosnowski",
      "classification": "primary",
      "entity_type": "person",
      "primary": true,
      "person_id": "~{\"name\": \"Sosnowski\"}",
      "organization_id": null
    },
    {
      "name": "Valverde",
      "classification": "primary",
      "entity_type": "person",
      "primary": true,
      "person_id": "~{\"name\": \"Valverde\"}",
      "organization_id": null
    },
    {
      "name": "Lawson",
      "classification": "primary",
      "entity_type": "person",
      "primary": true,
      "person_id": "~{\"name\": \"Lawson\"}",
      "organization_id": null
    },
    {
      "name": "Ciccone",
      "classification": "primary",
      "entity_type": "person",
      "primary": true,
      "person_id": "~{\"name\": \"Ciccone\"}",
      "organization_id": null
    },
    {
      "name": "Bissaillon",
      "classification": "primary",
      "entity_type": "person",
      "primary": true,
      "person_id": "~{\"name\": \"Bissaillon\"}",
      "organization_id": null
    },
    {
      "name": "Urso",
      "classification": "primary",
      "entity_type": "person",
      "primary": true,
      "person_id": "~{\"name\": \"Urso\"}",
      "organization_id": null
    }
  ],
  "related_bills": [],
  "versions": [
    {
      "note": "829\u00a0 SUB A",
      "links": [
        {
          "url": "http://webserver.rilegislature.gov/BillText/BillText25/SenateText25/S0829A.pdf",
          "media_type": "application/pdf"
        }
      ],
      "date": "",
      "classification": ""
    }
  ],
  "documents": [],
  "citations": [],
  "sources": [
    {
      "url": "https://status.rilegislature.gov/",
      "note": ""
    }
  ],
  "extras": {},
  "jurisdiction": {
    "id": "ocd-jurisdiction/country:us/state:ri/government",
    "name": "Rhode Island",
    "classification": "state",
    "division_id": "ocd-division/country:us/state:ri"
  },
  "_processing": {
    "logs_latest_update": "2025-11-26T03:04:58Z"
  }
}