{
  "legislative_session": "2025",
  "identifier": "SB828",
  "title": "AN ACT RELATING TO TOWNS AND CITIES -- RELIEF OF INJURED AND DECEASED FIRE FIGHTERS AND POLICE OFFICERS",
  "from_organization": "~{\"classification\": \"upper\"}",
  "classification": [
    "bill"
  ],
  "subject": [],
  "abstracts": [
    {
      "note": "summary",
      "abstract": "Includes police officers to fire fighters who are unable to perform duties as a result of heart disease, stroke or hypertension to be presumed to have suffered an in-the-line-of-duty disability, unless contrary evidence is presented."
    }
  ],
  "other_titles": [],
  "other_identifiers": [],
  "actions": [
    {
      "description": "03/14/2025 Introduced, referred to Senate Labor and Gaming",
      "date": "2025-03-14",
      "organization_id": "~{\"classification\": \"upper\"}",
      "classification": [
        "introduction",
        "referral-committee"
      ],
      "related_entities": [],
      "_processing": {
        "log_file_created": "2025-11-26T03:05:04Z"
      }
    },
    {
      "description": "05/02/2025 Scheduled for hearing and/or consideration  (05/07/2025)",
      "date": "2025-05-02",
      "organization_id": "~{\"classification\": \"legislature\"}",
      "classification": [],
      "related_entities": [],
      "_processing": {
        "log_file_created": "2025-11-26T03:05:04Z"
      }
    },
    {
      "description": "05/07/2025 Committee recommends passage",
      "date": "2025-05-07",
      "organization_id": "~{\"classification\": \"legislature\"}",
      "classification": [
        "committee-passage-favorable"
      ],
      "related_entities": [],
      "_processing": {
        "log_file_created": "2025-11-26T03:05:04Z"
      }
    },
    {
      "description": "05/08/2025 Placed on Senate Calendar  (05/15/2025)",
      "date": "2025-05-08",
      "organization_id": "~{\"classification\": \"upper\"}",
      "classification": [
        "reading-3"
      ],
      "related_entities": [],
      "_processing": {
        "log_file_created": "2025-11-26T03:05:04Z"
      }
    },
    {
      "description": "05/15/2025 Senate read and passed",
      "date": "2025-05-15",
      "organization_id": "~{\"classification\": \"upper\"}",
      "classification": [
        "passage"
      ],
      "related_entities": [],
      "_processing": {
        "log_file_created": "2025-11-26T03:05:04Z"
      }
    },
    {
      "description": "05/16/2025 Referred to House Municipal Government & Housing",
      "date": "2025-05-16",
      "organization_id": "~{\"classification\": \"lower\"}",
      "classification": [
        "referral-committee"
      ],
      "related_entities": [],
      "_processing": {
        "log_file_created": "2025-11-26T03:05:04Z"
      }
    },
    {
      "description": "06/13/2025 Scheduled for consideration  (06/16/2025)",
      "date": "2025-06-13",
      "organization_id": "~{\"classification\": \"legislature\"}",
      "classification": [],
      "related_entities": [],
      "_processing": {
        "log_file_created": "2025-11-26T03:05:04Z"
      }
    },
    {
      "description": "06/16/2025 Committee recommends passage in concurrence",
      "date": "2025-06-16",
      "organization_id": "~{\"classification\": \"legislature\"}",
      "classification": [
        "committee-passage-favorable"
      ],
      "related_entities": [],
      "_processing": {
        "log_file_created": "2025-11-26T03:05:04Z"
      }
    },
    {
      "description": "06/18/2025 Placed on House Calendar  (06/20/2025)",
      "date": "2025-06-18",
      "organization_id": "~{\"classification\": \"lower\"}",
      "classification": [
        "reading-3"
      ],
      "related_entities": [],
      "_processing": {
        "log_file_created": "2025-11-26T03:05:04Z"
      }
    },
    {
      "description": "06/20/2025 House passed in concurrence",
      "date": "2025-06-20",
      "organization_id": "~{\"classification\": \"lower\"}",
      "classification": [
        "passage"
      ],
      "related_entities": [],
      "_processing": {
        "log_file_created": "2025-11-26T03:05:04Z"
      }
    },
    {
      "description": "06/25/2025 Transmitted to Governor",
      "date": "2025-06-25",
      "organization_id": "~{\"classification\": \"executive\"}",
      "classification": [
        "executive-receipt"
      ],
      "related_entities": [],
      "_processing": {
        "log_file_created": "2025-11-26T03:05:04Z"
      }
    },
    {
      "description": "07/03/2025 Effective without Governor's signature",
      "date": "2025-07-03",
      "organization_id": "~{\"classification\": \"executive\"}",
      "classification": [
        "became-law"
      ],
      "related_entities": [],
      "_processing": {
        "log_file_created": "2025-11-26T03:05:04Z"
      }
    }
  ],
  "sponsorships": [
    {
      "name": "Ciccone",
      "classification": "primary",
      "entity_type": "person",
      "primary": true,
      "person_id": "~{\"name\": \"Ciccone\"}",
      "organization_id": null
    },
    {
      "name": "Raptakis",
      "classification": "primary",
      "entity_type": "person",
      "primary": true,
      "person_id": "~{\"name\": \"Raptakis\"}",
      "organization_id": null
    },
    {
      "name": "LaMountain",
      "classification": "primary",
      "entity_type": "person",
      "primary": true,
      "person_id": "~{\"name\": \"LaMountain\"}",
      "organization_id": null
    }
  ],
  "related_bills": [],
  "versions": [
    {
      "note": "828",
      "links": [
        {
          "url": "http://webserver.rilegislature.gov/BillText/BillText25/SenateText25/S0828.pdf",
          "media_type": "application/pdf"
        }
      ],
      "date": "",
      "classification": ""
    }
  ],
  "documents": [],
  "citations": [],
  "sources": [
    {
      "url": "https://status.rilegislature.gov/",
      "note": ""
    }
  ],
  "extras": {},
  "jurisdiction": {
    "id": "ocd-jurisdiction/country:us/state:ri/government",
    "name": "Rhode Island",
    "classification": "state",
    "division_id": "ocd-division/country:us/state:ri"
  },
  "_processing": {
    "logs_latest_update": "2025-11-26T03:05:04Z"
  }
}