{
  "legislative_session": "2025",
  "identifier": "HB5562",
  "title": "AN ACT RELATING TO BUSINESSES AND PROFESSIONS -- SOLICITATION BY CHARITABLE ORGANIZATIONS",
  "from_organization": "~{\"classification\": \"lower\"}",
  "classification": [
    "bill"
  ],
  "subject": [],
  "abstracts": [
    {
      "note": "summary",
      "abstract": "Provides that charitable organizations with a gross income of one million dollars ($1,000,000) or less can meet the required reporting and records requirements by providing either an IRS Form 900 or other approved financial statements."
    }
  ],
  "other_titles": [],
  "other_identifiers": [],
  "actions": [
    {
      "description": "02/26/2025 Introduced, referred to House Corporations",
      "date": "2025-02-26",
      "organization_id": "~{\"classification\": \"lower\"}",
      "classification": [
        "introduction",
        "referral-committee"
      ],
      "related_entities": [],
      "_processing": {
        "log_file_created": "2025-11-26T03:05:04Z"
      }
    },
    {
      "description": "02/28/2025 Scheduled for hearing and/or consideration  (03/04/2025)",
      "date": "2025-02-28",
      "organization_id": "~{\"classification\": \"legislature\"}",
      "classification": [],
      "related_entities": [],
      "_processing": {
        "log_file_created": "2025-11-26T03:05:04Z"
      }
    },
    {
      "description": "03/04/2025 Committee recommended measure be held for further study",
      "date": "2025-03-04",
      "organization_id": "~{\"classification\": \"legislature\"}",
      "classification": [
        "committee-failure"
      ],
      "related_entities": [],
      "_processing": {
        "log_file_created": "2025-11-26T03:05:04Z"
      }
    },
    {
      "description": "03/14/2025 Scheduled for consideration  (03/20/2025)",
      "date": "2025-03-14",
      "organization_id": "~{\"classification\": \"legislature\"}",
      "classification": [],
      "related_entities": [],
      "_processing": {
        "log_file_created": "2025-11-26T03:05:04Z"
      }
    },
    {
      "description": "03/20/2025 Committee recommends passage",
      "date": "2025-03-20",
      "organization_id": "~{\"classification\": \"legislature\"}",
      "classification": [
        "committee-passage-favorable"
      ],
      "related_entities": [],
      "_processing": {
        "log_file_created": "2025-11-26T03:05:04Z"
      }
    },
    {
      "description": "03/28/2025 Placed on House Calendar  (04/01/2025)",
      "date": "2025-03-28",
      "organization_id": "~{\"classification\": \"lower\"}",
      "classification": [
        "reading-3"
      ],
      "related_entities": [],
      "_processing": {
        "log_file_created": "2025-11-26T03:05:04Z"
      }
    },
    {
      "description": "04/01/2025 House read and passed",
      "date": "2025-04-01",
      "organization_id": "~{\"classification\": \"lower\"}",
      "classification": [
        "passage"
      ],
      "related_entities": [],
      "_processing": {
        "log_file_created": "2025-11-26T03:05:04Z"
      }
    },
    {
      "description": "05/02/2025 Referred to Senate Finance",
      "date": "2025-05-02",
      "organization_id": "~{\"classification\": \"upper\"}",
      "classification": [
        "referral-committee"
      ],
      "related_entities": [],
      "_processing": {
        "log_file_created": "2025-11-26T03:05:04Z"
      }
    },
    {
      "description": "06/16/2025 Scheduled for consideration  (06/18/2025)",
      "date": "2025-06-16",
      "organization_id": "~{\"classification\": \"legislature\"}",
      "classification": [],
      "related_entities": [],
      "_processing": {
        "log_file_created": "2025-11-26T03:05:04Z"
      }
    },
    {
      "description": "06/18/2025 Committee recommends passage in concurrence",
      "date": "2025-06-18",
      "organization_id": "~{\"classification\": \"legislature\"}",
      "classification": [
        "committee-passage-favorable"
      ],
      "related_entities": [],
      "_processing": {
        "log_file_created": "2025-11-26T03:05:04Z"
      }
    },
    {
      "description": "06/18/2025 Placed on Senate Calendar  (06/20/2025)",
      "date": "2025-06-18",
      "organization_id": "~{\"classification\": \"upper\"}",
      "classification": [
        "reading-3"
      ],
      "related_entities": [],
      "_processing": {
        "log_file_created": "2025-11-26T03:05:04Z"
      }
    },
    {
      "description": "06/21/2025 Senate passed in concurrence",
      "date": "2025-06-21",
      "organization_id": "~{\"classification\": \"upper\"}",
      "classification": [
        "passage"
      ],
      "related_entities": [],
      "_processing": {
        "log_file_created": "2025-11-26T03:05:04Z"
      }
    },
    {
      "description": "06/25/2025 Transmitted to Governor",
      "date": "2025-06-25",
      "organization_id": "~{\"classification\": \"executive\"}",
      "classification": [
        "executive-receipt"
      ],
      "related_entities": [],
      "_processing": {
        "log_file_created": "2025-11-26T03:05:04Z"
      }
    },
    {
      "description": "07/01/2025 Signed by Governor",
      "date": "2025-07-01",
      "organization_id": "~{\"classification\": \"executive\"}",
      "classification": [
        "executive-signature"
      ],
      "related_entities": [],
      "_processing": {
        "log_file_created": "2025-11-26T03:05:04Z"
      }
    }
  ],
  "sponsorships": [
    {
      "name": "Caldwell",
      "classification": "primary",
      "entity_type": "person",
      "primary": true,
      "person_id": "~{\"name\": \"Caldwell\"}",
      "organization_id": null
    }
  ],
  "related_bills": [],
  "versions": [
    {
      "note": "5562",
      "links": [
        {
          "url": "http://webserver.rilegislature.gov/BillText/BillText25/HouseText25/H5562.pdf",
          "media_type": "application/pdf"
        }
      ],
      "date": "",
      "classification": ""
    }
  ],
  "documents": [],
  "citations": [],
  "sources": [
    {
      "url": "https://status.rilegislature.gov/",
      "note": ""
    }
  ],
  "extras": {},
  "jurisdiction": {
    "id": "ocd-jurisdiction/country:us/state:ri/government",
    "name": "Rhode Island",
    "classification": "state",
    "division_id": "ocd-division/country:us/state:ri"
  },
  "_processing": {
    "logs_latest_update": "2025-11-26T03:05:04Z"
  }
}