{
  "legislative_session": "2025",
  "identifier": "SR174",
  "title": "JOINT RESOLUTION TO ESTABLISH A STATEWIDE MAIN STREET COORDINATING PROGRAM",
  "from_organization": "~{\"classification\": \"upper\"}",
  "classification": [
    "resolution"
  ],
  "subject": [],
  "abstracts": [
    {
      "note": "summary",
      "abstract": "Authorizes the appropriation of the sum of $500,000 for the formal establishment of \u201cMain Street Rhode Island\u201d."
    }
  ],
  "other_titles": [],
  "other_identifiers": [],
  "actions": [
    {
      "description": "02/07/2025 Introduced, referred to Senate Finance",
      "date": "2025-02-07",
      "organization_id": "~{\"classification\": \"upper\"}",
      "classification": [
        "introduction",
        "referral-committee"
      ],
      "related_entities": [],
      "_processing": {
        "log_file_created": "2025-11-26T03:05:02Z"
      }
    },
    {
      "description": "04/18/2025 Scheduled for hearing and/or consideration",
      "date": "2025-04-18",
      "organization_id": "~{\"classification\": \"legislature\"}",
      "classification": [],
      "related_entities": [],
      "_processing": {
        "log_file_created": "2025-11-26T03:05:02Z"
      }
    },
    {
      "description": "04/21/2025 Meeting postponed  (04/24/2025)",
      "date": "2025-04-21",
      "organization_id": "~{\"classification\": \"legislature\"}",
      "classification": [],
      "related_entities": [],
      "_processing": {
        "log_file_created": "2025-11-26T03:05:02Z"
      }
    },
    {
      "description": "05/02/2025 Scheduled for hearing and/or consideration  (05/06/2025)",
      "date": "2025-05-02",
      "organization_id": "~{\"classification\": \"legislature\"}",
      "classification": [],
      "related_entities": [],
      "_processing": {
        "log_file_created": "2025-11-26T03:05:02Z"
      }
    },
    {
      "description": "05/06/2025 Committee recommended measure be held for further study",
      "date": "2025-05-06",
      "organization_id": "~{\"classification\": \"legislature\"}",
      "classification": [
        "committee-failure"
      ],
      "related_entities": [],
      "_processing": {
        "log_file_created": "2025-11-26T03:05:02Z"
      }
    },
    {
      "description": "06/03/2025 Scheduled for consideration  (06/05/2025)",
      "date": "2025-06-03",
      "organization_id": "~{\"classification\": \"legislature\"}",
      "classification": [],
      "related_entities": [],
      "_processing": {
        "log_file_created": "2025-11-26T03:05:02Z"
      }
    },
    {
      "description": "06/18/2025 Placed on Senate Calendar  (06/20/2025)",
      "date": "2025-06-18",
      "organization_id": "~{\"classification\": \"upper\"}",
      "classification": [
        "reading-3"
      ],
      "related_entities": [],
      "_processing": {
        "log_file_created": "2025-11-26T03:05:02Z"
      }
    },
    {
      "description": "06/05/2025 Committee recommends passage",
      "date": "2025-06-05",
      "organization_id": "~{\"classification\": \"legislature\"}",
      "classification": [
        "committee-passage-favorable"
      ],
      "related_entities": [],
      "_processing": {
        "log_file_created": "2025-11-26T03:05:02Z"
      }
    },
    {
      "description": "06/20/2025 Placed on Senate Calendar  (06/20/2025)",
      "date": "2025-06-20",
      "organization_id": "~{\"classification\": \"upper\"}",
      "classification": [
        "reading-3"
      ],
      "related_entities": [],
      "_processing": {
        "log_file_created": "2025-11-26T03:05:02Z"
      }
    },
    {
      "description": "06/20/2025 Senate passed as amended (floor amendment)",
      "date": "2025-06-20",
      "organization_id": "~{\"classification\": \"upper\"}",
      "classification": [
        "passage"
      ],
      "related_entities": [],
      "_processing": {
        "log_file_created": "2025-11-26T03:05:02Z"
      }
    },
    {
      "description": "06/21/2025 Placed on House Calendar  (06/20/2025)",
      "date": "2025-06-21",
      "organization_id": "~{\"classification\": \"lower\"}",
      "classification": [
        "reading-3"
      ],
      "related_entities": [],
      "_processing": {
        "log_file_created": "2025-11-26T03:05:02Z"
      }
    },
    {
      "description": "06/21/2025 House passed as amended in concurrence",
      "date": "2025-06-21",
      "organization_id": "~{\"classification\": \"lower\"}",
      "classification": [
        "passage"
      ],
      "related_entities": [],
      "_processing": {
        "log_file_created": "2025-11-26T03:05:02Z"
      }
    },
    {
      "description": "06/25/2025 Transmitted to Governor",
      "date": "2025-06-25",
      "organization_id": "~{\"classification\": \"executive\"}",
      "classification": [
        "executive-receipt"
      ],
      "related_entities": [],
      "_processing": {
        "log_file_created": "2025-11-26T03:05:02Z"
      }
    },
    {
      "description": "07/03/2025 Effective without Governor's signature",
      "date": "2025-07-03",
      "organization_id": "~{\"classification\": \"executive\"}",
      "classification": [
        "became-law"
      ],
      "related_entities": [],
      "_processing": {
        "log_file_created": "2025-11-26T03:05:02Z"
      }
    }
  ],
  "sponsorships": [
    {
      "name": "Urso",
      "classification": "primary",
      "entity_type": "person",
      "primary": true,
      "person_id": "~{\"name\": \"Urso\"}",
      "organization_id": null
    },
    {
      "name": "Britto",
      "classification": "primary",
      "entity_type": "person",
      "primary": true,
      "person_id": "~{\"name\": \"Britto\"}",
      "organization_id": null
    },
    {
      "name": "Burke",
      "classification": "primary",
      "entity_type": "person",
      "primary": true,
      "person_id": "~{\"name\": \"Burke\"}",
      "organization_id": null
    },
    {
      "name": "Tikoian",
      "classification": "primary",
      "entity_type": "person",
      "primary": true,
      "person_id": "~{\"name\": \"Tikoian\"}",
      "organization_id": null
    },
    {
      "name": "Rogers",
      "classification": "primary",
      "entity_type": "person",
      "primary": true,
      "person_id": "~{\"name\": \"Rogers\"}",
      "organization_id": null
    },
    {
      "name": "LaMountain",
      "classification": "primary",
      "entity_type": "person",
      "primary": true,
      "person_id": "~{\"name\": \"LaMountain\"}",
      "organization_id": null
    },
    {
      "name": "Zurier",
      "classification": "primary",
      "entity_type": "person",
      "primary": true,
      "person_id": "~{\"name\": \"Zurier\"}",
      "organization_id": null
    },
    {
      "name": "Gu",
      "classification": "primary",
      "entity_type": "person",
      "primary": true,
      "person_id": "~{\"name\": \"Gu\"}",
      "organization_id": null
    },
    {
      "name": "Felag",
      "classification": "primary",
      "entity_type": "person",
      "primary": true,
      "person_id": "~{\"name\": \"Felag\"}",
      "organization_id": null
    },
    {
      "name": "Vargas",
      "classification": "primary",
      "entity_type": "person",
      "primary": true,
      "person_id": "~{\"name\": \"Vargas\"}",
      "organization_id": null
    }
  ],
  "related_bills": [],
  "versions": [
    {
      "note": "174\u00a0\u00a0as amended",
      "links": [
        {
          "url": "http://webserver.rilegislature.gov/BillText/BillText25/SenateText25/S0174aa.pdf",
          "media_type": "application/pdf"
        }
      ],
      "date": "",
      "classification": ""
    }
  ],
  "documents": [],
  "citations": [],
  "sources": [
    {
      "url": "https://status.rilegislature.gov/",
      "note": ""
    }
  ],
  "extras": {},
  "jurisdiction": {
    "id": "ocd-jurisdiction/country:us/state:ri/government",
    "name": "Rhode Island",
    "classification": "state",
    "division_id": "ocd-division/country:us/state:ri"
  },
  "_processing": {
    "logs_latest_update": "2025-11-26T03:05:02Z"
  }
}