{
  "legislative_session": "2025",
  "identifier": "SB468",
  "title": "AN ACT RELATING TO FOOD AND DRUGS -- PRESCRIPTION DRUG COST PROTECTION",
  "from_organization": "~{\"classification\": \"upper\"}",
  "classification": [
    "bill"
  ],
  "subject": [],
  "abstracts": [
    {
      "note": "summary",
      "abstract": "Prohibits the state, participating ERISA, or any health plan from purchasing referenced drugs for a cost higher than the referenced rate."
    }
  ],
  "other_titles": [],
  "other_identifiers": [],
  "actions": [
    {
      "description": "02/26/2025 Introduced, referred to Senate Health and Human Services",
      "date": "2025-02-26",
      "organization_id": "~{\"classification\": \"upper\"}",
      "classification": [
        "introduction",
        "referral-committee"
      ],
      "related_entities": [],
      "_processing": {
        "log_file_created": "2025-11-26T03:05:03Z"
      }
    },
    {
      "description": "03/14/2025 Scheduled for hearing and/or consideration  (03/20/2025)",
      "date": "2025-03-14",
      "organization_id": "~{\"classification\": \"legislature\"}",
      "classification": [],
      "related_entities": [],
      "_processing": {
        "log_file_created": "2025-11-26T03:05:03Z"
      }
    },
    {
      "description": "03/20/2025 Committee recommended measure be held for further study",
      "date": "2025-03-20",
      "organization_id": "~{\"classification\": \"legislature\"}",
      "classification": [
        "committee-failure"
      ],
      "related_entities": [],
      "_processing": {
        "log_file_created": "2025-11-26T03:05:03Z"
      }
    },
    {
      "description": "04/18/2025 Scheduled for consideration",
      "date": "2025-04-18",
      "organization_id": "~{\"classification\": \"legislature\"}",
      "classification": [],
      "related_entities": [],
      "_processing": {
        "log_file_created": "2025-11-26T03:05:03Z"
      }
    },
    {
      "description": "04/21/2025 Meeting postponed  (04/24/2025)",
      "date": "2025-04-21",
      "organization_id": "~{\"classification\": \"legislature\"}",
      "classification": [],
      "related_entities": [],
      "_processing": {
        "log_file_created": "2025-11-26T03:05:03Z"
      }
    },
    {
      "description": "05/02/2025 Scheduled for consideration  (05/06/2025)",
      "date": "2025-05-02",
      "organization_id": "~{\"classification\": \"legislature\"}",
      "classification": [],
      "related_entities": [],
      "_processing": {
        "log_file_created": "2025-11-26T03:05:03Z"
      }
    },
    {
      "description": "05/06/2025 Committee recommends passage",
      "date": "2025-05-06",
      "organization_id": "~{\"classification\": \"legislature\"}",
      "classification": [
        "committee-passage-favorable"
      ],
      "related_entities": [],
      "_processing": {
        "log_file_created": "2025-11-26T03:05:03Z"
      }
    },
    {
      "description": "05/07/2025 Placed on Senate Calendar  (05/15/2025)",
      "date": "2025-05-07",
      "organization_id": "~{\"classification\": \"upper\"}",
      "classification": [
        "reading-3"
      ],
      "related_entities": [],
      "_processing": {
        "log_file_created": "2025-11-26T03:05:03Z"
      }
    },
    {
      "description": "05/15/2025 Senate passed as amended (floor amendment)",
      "date": "2025-05-15",
      "organization_id": "~{\"classification\": \"upper\"}",
      "classification": [
        "passage"
      ],
      "related_entities": [],
      "_processing": {
        "log_file_created": "2025-11-26T03:05:03Z"
      }
    },
    {
      "description": "05/16/2025 Referred to House Health & Human Services",
      "date": "2025-05-16",
      "organization_id": "~{\"classification\": \"lower\"}",
      "classification": [
        "referral-committee"
      ],
      "related_entities": [],
      "_processing": {
        "log_file_created": "2025-11-26T03:05:03Z"
      }
    }
  ],
  "sponsorships": [
    {
      "name": "DiPalma",
      "classification": "primary",
      "entity_type": "person",
      "primary": true,
      "person_id": "~{\"name\": \"DiPalma\"}",
      "organization_id": null
    },
    {
      "name": "Ujifusa",
      "classification": "primary",
      "entity_type": "person",
      "primary": true,
      "person_id": "~{\"name\": \"Ujifusa\"}",
      "organization_id": null
    },
    {
      "name": "Murray",
      "classification": "primary",
      "entity_type": "person",
      "primary": true,
      "person_id": "~{\"name\": \"Murray\"}",
      "organization_id": null
    }
  ],
  "related_bills": [],
  "versions": [
    {
      "note": "468\u00a0\u00a0as amended",
      "links": [
        {
          "url": "http://webserver.rilegislature.gov/BillText/BillText25/SenateText25/S0468aa.pdf",
          "media_type": "application/pdf"
        }
      ],
      "date": "",
      "classification": ""
    }
  ],
  "documents": [],
  "citations": [],
  "sources": [
    {
      "url": "https://status.rilegislature.gov/",
      "note": ""
    }
  ],
  "extras": {},
  "jurisdiction": {
    "id": "ocd-jurisdiction/country:us/state:ri/government",
    "name": "Rhode Island",
    "classification": "state",
    "division_id": "ocd-division/country:us/state:ri"
  },
  "_processing": {
    "logs_latest_update": "2025-11-26T03:05:03Z"
  }
}