{
  "legislative_session": "2025",
  "identifier": "HB5715",
  "title": "AN ACT RELATING TO PUBLIC OFFICERS AND EMPLOYEES -- RETIREMENT SYSTEM--ADMINISTRATION",
  "from_organization": "~{\"classification\": \"lower\"}",
  "classification": [
    "bill"
  ],
  "subject": [],
  "abstracts": [
    {
      "note": "summary",
      "abstract": "Requires the state retirement board to publish online all archived video or audio recordings and all future recordings of meetings of the board."
    }
  ],
  "other_titles": [],
  "other_identifiers": [],
  "actions": [
    {
      "description": "02/26/2025 Introduced, referred to House State Government & Elections",
      "date": "2025-02-26",
      "organization_id": "~{\"classification\": \"lower\"}",
      "classification": [
        "introduction",
        "referral-committee"
      ],
      "related_entities": [],
      "_processing": {
        "log_file_created": "2025-11-26T03:05:00Z"
      }
    },
    {
      "description": "04/18/2025 Scheduled for hearing and/or consideration  (04/22/2025)",
      "date": "2025-04-18",
      "organization_id": "~{\"classification\": \"legislature\"}",
      "classification": [],
      "related_entities": [],
      "_processing": {
        "log_file_created": "2025-11-26T03:05:00Z"
      }
    },
    {
      "description": "04/22/2025 Committee recommended measure be held for further study",
      "date": "2025-04-22",
      "organization_id": "~{\"classification\": \"legislature\"}",
      "classification": [
        "committee-failure"
      ],
      "related_entities": [],
      "_processing": {
        "log_file_created": "2025-11-26T03:05:00Z"
      }
    },
    {
      "description": "05/09/2025 Scheduled for consideration  (05/15/2025)",
      "date": "2025-05-09",
      "organization_id": "~{\"classification\": \"legislature\"}",
      "classification": [],
      "related_entities": [],
      "_processing": {
        "log_file_created": "2025-11-26T03:05:00Z"
      }
    },
    {
      "description": "05/09/2025 Proposed Substitute",
      "date": "2025-05-09",
      "organization_id": "~{\"classification\": \"legislature\"}",
      "classification": [
        "substitution"
      ],
      "related_entities": [],
      "_processing": {
        "log_file_created": "2025-11-26T03:05:00Z"
      }
    },
    {
      "description": "05/15/2025 Committee recommends passage of Sub A",
      "date": "2025-05-15",
      "organization_id": "~{\"classification\": \"legislature\"}",
      "classification": [
        "committee-passage-favorable"
      ],
      "related_entities": [],
      "_processing": {
        "log_file_created": "2025-11-26T03:05:00Z"
      }
    },
    {
      "description": "05/23/2025 Placed on House Calendar  (05/29/2025)",
      "date": "2025-05-23",
      "organization_id": "~{\"classification\": \"lower\"}",
      "classification": [
        "reading-3"
      ],
      "related_entities": [],
      "_processing": {
        "log_file_created": "2025-11-26T03:05:00Z"
      }
    },
    {
      "description": "05/29/2025 House passed Sub A",
      "date": "2025-05-29",
      "organization_id": "~{\"classification\": \"lower\"}",
      "classification": [
        "passage"
      ],
      "related_entities": [],
      "_processing": {
        "log_file_created": "2025-11-26T03:05:00Z"
      }
    },
    {
      "description": "05/30/2025 Referred to Senate Judiciary",
      "date": "2025-05-30",
      "organization_id": "~{\"classification\": \"upper\"}",
      "classification": [
        "referral-committee"
      ],
      "related_entities": [],
      "_processing": {
        "log_file_created": "2025-11-26T03:05:00Z"
      }
    },
    {
      "description": "05/30/2025 Scheduled for consideration  (06/02/2025)",
      "date": "2025-05-30",
      "organization_id": "~{\"classification\": \"legislature\"}",
      "classification": [],
      "related_entities": [],
      "_processing": {
        "log_file_created": "2025-11-26T03:05:00Z"
      }
    },
    {
      "description": "06/02/2025 Committee recommends passage of Sub A in concurrence",
      "date": "2025-06-02",
      "organization_id": "~{\"classification\": \"legislature\"}",
      "classification": [
        "committee-passage-favorable"
      ],
      "related_entities": [],
      "_processing": {
        "log_file_created": "2025-11-26T03:05:00Z"
      }
    },
    {
      "description": "06/06/2025 Placed on the Senate Consent Calendar  (06/10/2025)",
      "date": "2025-06-06",
      "organization_id": "~{\"classification\": \"upper\"}",
      "classification": [
        "reading-3"
      ],
      "related_entities": [],
      "_processing": {
        "log_file_created": "2025-11-26T03:05:00Z"
      }
    },
    {
      "description": "06/10/2025 Senate passed Sub A in concurrence",
      "date": "2025-06-10",
      "organization_id": "~{\"classification\": \"upper\"}",
      "classification": [
        "passage"
      ],
      "related_entities": [],
      "_processing": {
        "log_file_created": "2025-11-26T03:05:00Z"
      }
    },
    {
      "description": "06/10/2025 Transmitted to Governor",
      "date": "2025-06-10",
      "organization_id": "~{\"classification\": \"executive\"}",
      "classification": [
        "executive-receipt"
      ],
      "related_entities": [],
      "_processing": {
        "log_file_created": "2025-11-26T03:05:00Z"
      }
    },
    {
      "description": "06/13/2025 Signed by Governor",
      "date": "2025-06-13",
      "organization_id": "~{\"classification\": \"executive\"}",
      "classification": [
        "executive-signature"
      ],
      "related_entities": [],
      "_processing": {
        "log_file_created": "2025-11-26T03:05:00Z"
      }
    }
  ],
  "sponsorships": [
    {
      "name": "Serpa",
      "classification": "primary",
      "entity_type": "person",
      "primary": true,
      "person_id": "~{\"name\": \"Serpa\"}",
      "organization_id": null
    },
    {
      "name": "Fellela",
      "classification": "primary",
      "entity_type": "person",
      "primary": true,
      "person_id": "~{\"name\": \"Fellela\"}",
      "organization_id": null
    }
  ],
  "related_bills": [],
  "versions": [
    {
      "note": "5715\u00a0 SUB A",
      "links": [
        {
          "url": "http://webserver.rilegislature.gov/BillText/BillText25/HouseText25/H5715A.pdf",
          "media_type": "application/pdf"
        }
      ],
      "date": "",
      "classification": ""
    }
  ],
  "documents": [],
  "citations": [],
  "sources": [
    {
      "url": "https://status.rilegislature.gov/",
      "note": ""
    }
  ],
  "extras": {},
  "jurisdiction": {
    "id": "ocd-jurisdiction/country:us/state:ri/government",
    "name": "Rhode Island",
    "classification": "state",
    "division_id": "ocd-division/country:us/state:ri"
  },
  "_processing": {
    "logs_latest_update": "2025-11-26T03:05:00Z"
  }
}