{
  "legislative_session": "2025",
  "identifier": "SB266",
  "title": "AN ACT RELATING TO BUSINESSES AND PROFESSIONS -- LICENSE PROCEDURE FOR SOCIAL WORKERS",
  "from_organization": "~{\"classification\": \"upper\"}",
  "classification": [
    "bill"
  ],
  "subject": [],
  "abstracts": [
    {
      "note": "summary",
      "abstract": "Repeals the examination requirement in order to qualify for a clinical social workers license."
    }
  ],
  "other_titles": [],
  "other_identifiers": [],
  "actions": [
    {
      "description": "02/13/2025 Introduced, referred to Senate Health and Human Services",
      "date": "2025-02-13",
      "organization_id": "~{\"classification\": \"upper\"}",
      "classification": [
        "introduction",
        "referral-committee"
      ],
      "related_entities": [],
      "_processing": {
        "log_file_created": "2025-11-26T03:04:59Z"
      }
    },
    {
      "description": "02/28/2025 Scheduled for hearing and/or consideration  (03/06/2025)",
      "date": "2025-02-28",
      "organization_id": "~{\"classification\": \"legislature\"}",
      "classification": [],
      "related_entities": [],
      "_processing": {
        "log_file_created": "2025-11-26T03:04:59Z"
      }
    },
    {
      "description": "03/06/2025 Committee recommended measure be held for further study",
      "date": "2025-03-06",
      "organization_id": "~{\"classification\": \"legislature\"}",
      "classification": [
        "committee-failure"
      ],
      "related_entities": [],
      "_processing": {
        "log_file_created": "2025-11-26T03:04:59Z"
      }
    },
    {
      "description": "05/23/2025 Scheduled for consideration  (05/27/2025)",
      "date": "2025-05-23",
      "organization_id": "~{\"classification\": \"legislature\"}",
      "classification": [],
      "related_entities": [],
      "_processing": {
        "log_file_created": "2025-11-26T03:04:59Z"
      }
    },
    {
      "description": "05/27/2025 Committee recommends passage",
      "date": "2025-05-27",
      "organization_id": "~{\"classification\": \"legislature\"}",
      "classification": [
        "committee-passage-favorable"
      ],
      "related_entities": [],
      "_processing": {
        "log_file_created": "2025-11-26T03:04:59Z"
      }
    },
    {
      "description": "05/27/2025 Placed on Senate Calendar  (06/03/2025)",
      "date": "2025-05-27",
      "organization_id": "~{\"classification\": \"upper\"}",
      "classification": [
        "reading-3"
      ],
      "related_entities": [],
      "_processing": {
        "log_file_created": "2025-11-26T03:04:59Z"
      }
    },
    {
      "description": "06/03/2025 Senate read and passed",
      "date": "2025-06-03",
      "organization_id": "~{\"classification\": \"upper\"}",
      "classification": [
        "passage"
      ],
      "related_entities": [],
      "_processing": {
        "log_file_created": "2025-11-26T03:04:59Z"
      }
    },
    {
      "description": "06/08/2025 Placed on House Calendar  (06/10/2025)",
      "date": "2025-06-08",
      "organization_id": "~{\"classification\": \"lower\"}",
      "classification": [
        "reading-3"
      ],
      "related_entities": [],
      "_processing": {
        "log_file_created": "2025-11-26T03:04:59Z"
      }
    },
    {
      "description": "06/10/2025 House passed as amended (floor amendment)",
      "date": "2025-06-10",
      "organization_id": "~{\"classification\": \"lower\"}",
      "classification": [
        "passage"
      ],
      "related_entities": [],
      "_processing": {
        "log_file_created": "2025-11-26T03:04:59Z"
      }
    },
    {
      "description": "06/16/2025 Placed on Senate Calendar  (06/18/2025)",
      "date": "2025-06-16",
      "organization_id": "~{\"classification\": \"upper\"}",
      "classification": [
        "reading-3"
      ],
      "related_entities": [],
      "_processing": {
        "log_file_created": "2025-11-26T03:04:59Z"
      }
    },
    {
      "description": "06/18/2025 Senate passed as amended in concurrence",
      "date": "2025-06-18",
      "organization_id": "~{\"classification\": \"upper\"}",
      "classification": [
        "passage"
      ],
      "related_entities": [],
      "_processing": {
        "log_file_created": "2025-11-26T03:04:59Z"
      }
    },
    {
      "description": "06/23/2025 Transmitted to Governor",
      "date": "2025-06-23",
      "organization_id": "~{\"classification\": \"executive\"}",
      "classification": [
        "executive-receipt"
      ],
      "related_entities": [],
      "_processing": {
        "log_file_created": "2025-11-26T03:04:59Z"
      }
    },
    {
      "description": "06/26/2025 Signed by Governor",
      "date": "2025-06-26",
      "organization_id": "~{\"classification\": \"executive\"}",
      "classification": [
        "executive-signature"
      ],
      "related_entities": [],
      "_processing": {
        "log_file_created": "2025-11-26T03:04:59Z"
      }
    }
  ],
  "sponsorships": [
    {
      "name": "DiMario",
      "classification": "primary",
      "entity_type": "person",
      "primary": true,
      "person_id": "~{\"name\": \"DiMario\"}",
      "organization_id": null
    },
    {
      "name": "Valverde",
      "classification": "primary",
      "entity_type": "person",
      "primary": true,
      "person_id": "~{\"name\": \"Valverde\"}",
      "organization_id": null
    },
    {
      "name": "Sosnowski",
      "classification": "primary",
      "entity_type": "person",
      "primary": true,
      "person_id": "~{\"name\": \"Sosnowski\"}",
      "organization_id": null
    },
    {
      "name": "Appollonio",
      "classification": "primary",
      "entity_type": "person",
      "primary": true,
      "person_id": "~{\"name\": \"Appollonio\"}",
      "organization_id": null
    },
    {
      "name": "Thompson",
      "classification": "primary",
      "entity_type": "person",
      "primary": true,
      "person_id": "~{\"name\": \"Thompson\"}",
      "organization_id": null
    },
    {
      "name": "Lawson",
      "classification": "primary",
      "entity_type": "person",
      "primary": true,
      "person_id": "~{\"name\": \"Lawson\"}",
      "organization_id": null
    },
    {
      "name": "Urso",
      "classification": "primary",
      "entity_type": "person",
      "primary": true,
      "person_id": "~{\"name\": \"Urso\"}",
      "organization_id": null
    },
    {
      "name": "Ujifusa",
      "classification": "primary",
      "entity_type": "person",
      "primary": true,
      "person_id": "~{\"name\": \"Ujifusa\"}",
      "organization_id": null
    },
    {
      "name": "Lauria",
      "classification": "primary",
      "entity_type": "person",
      "primary": true,
      "person_id": "~{\"name\": \"Lauria\"}",
      "organization_id": null
    },
    {
      "name": "Murray",
      "classification": "primary",
      "entity_type": "person",
      "primary": true,
      "person_id": "~{\"name\": \"Murray\"}",
      "organization_id": null
    }
  ],
  "related_bills": [],
  "versions": [
    {
      "note": "266\u00a0\u00a0as amended",
      "links": [
        {
          "url": "http://webserver.rilegislature.gov/BillText/BillText25/SenateText25/S0266aa.pdf",
          "media_type": "application/pdf"
        }
      ],
      "date": "",
      "classification": ""
    }
  ],
  "documents": [],
  "citations": [],
  "sources": [
    {
      "url": "https://status.rilegislature.gov/",
      "note": ""
    }
  ],
  "extras": {},
  "jurisdiction": {
    "id": "ocd-jurisdiction/country:us/state:ri/government",
    "name": "Rhode Island",
    "classification": "state",
    "division_id": "ocd-division/country:us/state:ri"
  },
  "_processing": {
    "logs_latest_update": "2025-11-26T03:04:59Z"
  }
}