{
  "legislative_session": "2025",
  "identifier": "SB387",
  "title": "AN ACT RELATING TO PUBLIC PROPERTY AND WORKS -- PUBLIC BUILDINGS",
  "from_organization": "~{\"classification\": \"upper\"}",
  "classification": [
    "bill"
  ],
  "subject": [],
  "abstracts": [
    {
      "note": "summary",
      "abstract": "Requires the installation of universal changing stations in all newly constructed, reconstructed, or remodeled public buildings and places of public accommodation."
    }
  ],
  "other_titles": [],
  "other_identifiers": [],
  "actions": [
    {
      "description": "02/26/2025 Introduced, referred to Senate Commerce",
      "date": "2025-02-26",
      "organization_id": "~{\"classification\": \"upper\"}",
      "classification": [
        "introduction",
        "referral-committee"
      ],
      "related_entities": [],
      "_processing": {
        "log_file_created": "2025-11-26T03:05:05Z"
      }
    },
    {
      "description": "03/07/2025 Scheduled for hearing and/or consideration  (03/11/2025)",
      "date": "2025-03-07",
      "organization_id": "~{\"classification\": \"legislature\"}",
      "classification": [],
      "related_entities": [],
      "_processing": {
        "log_file_created": "2025-11-26T03:05:05Z"
      }
    },
    {
      "description": "03/11/2025 Committee recommended measure be held for further study",
      "date": "2025-03-11",
      "organization_id": "~{\"classification\": \"legislature\"}",
      "classification": [
        "committee-failure"
      ],
      "related_entities": [],
      "_processing": {
        "log_file_created": "2025-11-26T03:05:05Z"
      }
    },
    {
      "description": "04/18/2025 Scheduled for consideration",
      "date": "2025-04-18",
      "organization_id": "~{\"classification\": \"legislature\"}",
      "classification": [],
      "related_entities": [],
      "_processing": {
        "log_file_created": "2025-11-26T03:05:05Z"
      }
    },
    {
      "description": "04/21/2025 Meeting postponed  (04/22/2025)",
      "date": "2025-04-21",
      "organization_id": "~{\"classification\": \"legislature\"}",
      "classification": [],
      "related_entities": [],
      "_processing": {
        "log_file_created": "2025-11-26T03:05:05Z"
      }
    },
    {
      "description": "04/29/2025 Scheduled for consideration  (05/01/2025)",
      "date": "2025-04-29",
      "organization_id": "~{\"classification\": \"legislature\"}",
      "classification": [],
      "related_entities": [],
      "_processing": {
        "log_file_created": "2025-11-26T03:05:05Z"
      }
    },
    {
      "description": "05/01/2025 Committee recommends passage",
      "date": "2025-05-01",
      "organization_id": "~{\"classification\": \"legislature\"}",
      "classification": [
        "committee-passage-favorable"
      ],
      "related_entities": [],
      "_processing": {
        "log_file_created": "2025-11-26T03:05:05Z"
      }
    },
    {
      "description": "05/01/2025 Placed on Senate Calendar  (05/08/2025)",
      "date": "2025-05-01",
      "organization_id": "~{\"classification\": \"upper\"}",
      "classification": [
        "reading-3"
      ],
      "related_entities": [],
      "_processing": {
        "log_file_created": "2025-11-26T03:05:05Z"
      }
    },
    {
      "description": "05/08/2025 Senate read and passed",
      "date": "2025-05-08",
      "organization_id": "~{\"classification\": \"upper\"}",
      "classification": [
        "passage"
      ],
      "related_entities": [],
      "_processing": {
        "log_file_created": "2025-11-26T03:05:05Z"
      }
    },
    {
      "description": "05/09/2025 Referred to House State Government & Elections",
      "date": "2025-05-09",
      "organization_id": "~{\"classification\": \"lower\"}",
      "classification": [
        "referral-committee"
      ],
      "related_entities": [],
      "_processing": {
        "log_file_created": "2025-11-26T03:05:05Z"
      }
    },
    {
      "description": "05/25/2025 Scheduled for consideration  (05/29/2025)",
      "date": "2025-05-25",
      "organization_id": "~{\"classification\": \"legislature\"}",
      "classification": [],
      "related_entities": [],
      "_processing": {
        "log_file_created": "2025-11-26T03:05:05Z"
      }
    },
    {
      "description": "05/29/2025 Committee recommends passage in concurrence",
      "date": "2025-05-29",
      "organization_id": "~{\"classification\": \"legislature\"}",
      "classification": [
        "committee-passage-favorable"
      ],
      "related_entities": [],
      "_processing": {
        "log_file_created": "2025-11-26T03:05:05Z"
      }
    },
    {
      "description": "06/06/2025 Placed on the House Consent Calendar  (06/10/2025)",
      "date": "2025-06-06",
      "organization_id": "~{\"classification\": \"lower\"}",
      "classification": [
        "reading-3"
      ],
      "related_entities": [],
      "_processing": {
        "log_file_created": "2025-11-26T03:05:05Z"
      }
    },
    {
      "description": "06/10/2025 House passed in concurrence",
      "date": "2025-06-10",
      "organization_id": "~{\"classification\": \"lower\"}",
      "classification": [
        "passage"
      ],
      "related_entities": [],
      "_processing": {
        "log_file_created": "2025-11-26T03:05:05Z"
      }
    },
    {
      "description": "06/10/2025 Transmitted to Governor",
      "date": "2025-06-10",
      "organization_id": "~{\"classification\": \"executive\"}",
      "classification": [
        "executive-receipt"
      ],
      "related_entities": [],
      "_processing": {
        "log_file_created": "2025-11-26T03:05:05Z"
      }
    },
    {
      "description": "06/13/2025 Signed by Governor",
      "date": "2025-06-13",
      "organization_id": "~{\"classification\": \"executive\"}",
      "classification": [
        "executive-signature"
      ],
      "related_entities": [],
      "_processing": {
        "log_file_created": "2025-11-26T03:05:05Z"
      }
    }
  ],
  "sponsorships": [
    {
      "name": "Appollonio",
      "classification": "primary",
      "entity_type": "person",
      "primary": true,
      "person_id": "~{\"name\": \"Appollonio\"}",
      "organization_id": null
    },
    {
      "name": "Dimitri",
      "classification": "primary",
      "entity_type": "person",
      "primary": true,
      "person_id": "~{\"name\": \"Dimitri\"}",
      "organization_id": null
    },
    {
      "name": "Urso",
      "classification": "primary",
      "entity_type": "person",
      "primary": true,
      "person_id": "~{\"name\": \"Urso\"}",
      "organization_id": null
    },
    {
      "name": "Bissaillon",
      "classification": "primary",
      "entity_type": "person",
      "primary": true,
      "person_id": "~{\"name\": \"Bissaillon\"}",
      "organization_id": null
    },
    {
      "name": "Tikoian",
      "classification": "primary",
      "entity_type": "person",
      "primary": true,
      "person_id": "~{\"name\": \"Tikoian\"}",
      "organization_id": null
    },
    {
      "name": "DiPalma",
      "classification": "primary",
      "entity_type": "person",
      "primary": true,
      "person_id": "~{\"name\": \"DiPalma\"}",
      "organization_id": null
    },
    {
      "name": "Pearson",
      "classification": "primary",
      "entity_type": "person",
      "primary": true,
      "person_id": "~{\"name\": \"Pearson\"}",
      "organization_id": null
    },
    {
      "name": "Burke",
      "classification": "primary",
      "entity_type": "person",
      "primary": true,
      "person_id": "~{\"name\": \"Burke\"}",
      "organization_id": null
    },
    {
      "name": "Euer",
      "classification": "primary",
      "entity_type": "person",
      "primary": true,
      "person_id": "~{\"name\": \"Euer\"}",
      "organization_id": null
    },
    {
      "name": "McKenney",
      "classification": "primary",
      "entity_type": "person",
      "primary": true,
      "person_id": "~{\"name\": \"McKenney\"}",
      "organization_id": null
    }
  ],
  "related_bills": [],
  "versions": [
    {
      "note": "387",
      "links": [
        {
          "url": "http://webserver.rilegislature.gov/BillText/BillText25/SenateText25/S0387.pdf",
          "media_type": "application/pdf"
        }
      ],
      "date": "",
      "classification": ""
    }
  ],
  "documents": [],
  "citations": [],
  "sources": [
    {
      "url": "https://status.rilegislature.gov/",
      "note": ""
    }
  ],
  "extras": {},
  "jurisdiction": {
    "id": "ocd-jurisdiction/country:us/state:ri/government",
    "name": "Rhode Island",
    "classification": "state",
    "division_id": "ocd-division/country:us/state:ri"
  },
  "_processing": {
    "logs_latest_update": "2025-11-26T03:05:05Z"
  }
}