{
  "legislative_session": "2025",
  "identifier": "HB5019",
  "title": "AN ACT RELATING TO HEALTH AND SAFETY -- CONSUMER PFAS BAN ACT OF 2024",
  "from_organization": "~{\"classification\": \"lower\"}",
  "classification": [
    "bill"
  ],
  "subject": [],
  "abstracts": [
    {
      "note": "summary",
      "abstract": "Prohibits a manufacturer from manufacturing, knowingly selling, offering for sale, distributing for sale or distributing for use in the state any firefighting personal protective equipment containing intentionally-added PFAS as of January 1, 2027."
    }
  ],
  "other_titles": [],
  "other_identifiers": [],
  "actions": [
    {
      "description": "01/10/2025 Introduced, referred to House Environment and Natural Resources",
      "date": "2025-01-10",
      "organization_id": "~{\"classification\": \"lower\"}",
      "classification": [
        "introduction",
        "referral-committee"
      ],
      "related_entities": [],
      "_processing": {
        "log_file_created": "2025-11-26T03:04:57Z"
      }
    },
    {
      "description": "01/31/2025 Scheduled for hearing and/or consideration  (02/06/2025)",
      "date": "2025-01-31",
      "organization_id": "~{\"classification\": \"legislature\"}",
      "classification": [],
      "related_entities": [],
      "_processing": {
        "log_file_created": "2025-11-26T03:04:57Z"
      }
    },
    {
      "description": "02/06/2025 Committee recommended measure be held for further study",
      "date": "2025-02-06",
      "organization_id": "~{\"classification\": \"legislature\"}",
      "classification": [
        "committee-failure"
      ],
      "related_entities": [],
      "_processing": {
        "log_file_created": "2025-11-26T03:04:57Z"
      }
    },
    {
      "description": "02/21/2025 Scheduled for consideration  (02/27/2025)",
      "date": "2025-02-21",
      "organization_id": "~{\"classification\": \"legislature\"}",
      "classification": [],
      "related_entities": [],
      "_processing": {
        "log_file_created": "2025-11-26T03:04:57Z"
      }
    },
    {
      "description": "02/27/2025 Committee recommends passage",
      "date": "2025-02-27",
      "organization_id": "~{\"classification\": \"legislature\"}",
      "classification": [
        "committee-passage-favorable"
      ],
      "related_entities": [],
      "_processing": {
        "log_file_created": "2025-11-26T03:04:57Z"
      }
    },
    {
      "description": "02/28/2025 Placed on House Calendar  (03/06/2025)",
      "date": "2025-02-28",
      "organization_id": "~{\"classification\": \"lower\"}",
      "classification": [
        "reading-3"
      ],
      "related_entities": [],
      "_processing": {
        "log_file_created": "2025-11-26T03:04:57Z"
      }
    },
    {
      "description": "03/06/2025 House read and passed",
      "date": "2025-03-06",
      "organization_id": "~{\"classification\": \"lower\"}",
      "classification": [
        "passage"
      ],
      "related_entities": [],
      "_processing": {
        "log_file_created": "2025-11-26T03:04:57Z"
      }
    },
    {
      "description": "03/21/2025 Referred to Senate Environment and Agriculture",
      "date": "2025-03-21",
      "organization_id": "~{\"classification\": \"upper\"}",
      "classification": [
        "referral-committee"
      ],
      "related_entities": [],
      "_processing": {
        "log_file_created": "2025-11-26T03:04:57Z"
      }
    },
    {
      "description": "04/18/2025 Scheduled for consideration",
      "date": "2025-04-18",
      "organization_id": "~{\"classification\": \"legislature\"}",
      "classification": [],
      "related_entities": [],
      "_processing": {
        "log_file_created": "2025-11-26T03:04:57Z"
      }
    },
    {
      "description": "04/21/2025 Meeting postponed  (04/23/2025)",
      "date": "2025-04-21",
      "organization_id": "~{\"classification\": \"legislature\"}",
      "classification": [],
      "related_entities": [],
      "_processing": {
        "log_file_created": "2025-11-26T03:04:57Z"
      }
    },
    {
      "description": "05/02/2025 Scheduled for consideration  (05/07/2025)",
      "date": "2025-05-02",
      "organization_id": "~{\"classification\": \"legislature\"}",
      "classification": [],
      "related_entities": [],
      "_processing": {
        "log_file_created": "2025-11-26T03:04:57Z"
      }
    },
    {
      "description": "05/07/2025 Committee recommends passage in concurrence",
      "date": "2025-05-07",
      "organization_id": "~{\"classification\": \"legislature\"}",
      "classification": [
        "committee-passage-favorable"
      ],
      "related_entities": [],
      "_processing": {
        "log_file_created": "2025-11-26T03:04:57Z"
      }
    },
    {
      "description": "05/30/2025 Placed on the Senate Consent Calendar  (06/05/2025)",
      "date": "2025-05-30",
      "organization_id": "~{\"classification\": \"upper\"}",
      "classification": [
        "reading-3"
      ],
      "related_entities": [],
      "_processing": {
        "log_file_created": "2025-11-26T03:04:57Z"
      }
    },
    {
      "description": "06/05/2025 Senate passed in concurrence",
      "date": "2025-06-05",
      "organization_id": "~{\"classification\": \"upper\"}",
      "classification": [
        "passage"
      ],
      "related_entities": [],
      "_processing": {
        "log_file_created": "2025-11-26T03:04:57Z"
      }
    },
    {
      "description": "06/05/2025 Transmitted to Governor",
      "date": "2025-06-05",
      "organization_id": "~{\"classification\": \"executive\"}",
      "classification": [
        "executive-receipt"
      ],
      "related_entities": [],
      "_processing": {
        "log_file_created": "2025-11-26T03:04:57Z"
      }
    },
    {
      "description": "06/10/2025 Signed by Governor",
      "date": "2025-06-10",
      "organization_id": "~{\"classification\": \"executive\"}",
      "classification": [
        "executive-signature"
      ],
      "related_entities": [],
      "_processing": {
        "log_file_created": "2025-11-26T03:04:57Z"
      }
    }
  ],
  "sponsorships": [
    {
      "name": "Speakman",
      "classification": "primary",
      "entity_type": "person",
      "primary": true,
      "person_id": "~{\"name\": \"Speakman\"}",
      "organization_id": null
    },
    {
      "name": "Casey",
      "classification": "primary",
      "entity_type": "person",
      "primary": true,
      "person_id": "~{\"name\": \"Casey\"}",
      "organization_id": null
    },
    {
      "name": "Knight",
      "classification": "primary",
      "entity_type": "person",
      "primary": true,
      "person_id": "~{\"name\": \"Knight\"}",
      "organization_id": null
    },
    {
      "name": "Noret",
      "classification": "primary",
      "entity_type": "person",
      "primary": true,
      "person_id": "~{\"name\": \"Noret\"}",
      "organization_id": null
    },
    {
      "name": "Read",
      "classification": "primary",
      "entity_type": "person",
      "primary": true,
      "person_id": "~{\"name\": \"Read\"}",
      "organization_id": null
    },
    {
      "name": "Kislak",
      "classification": "primary",
      "entity_type": "person",
      "primary": true,
      "person_id": "~{\"name\": \"Kislak\"}",
      "organization_id": null
    },
    {
      "name": "Cortvriend",
      "classification": "primary",
      "entity_type": "person",
      "primary": true,
      "person_id": "~{\"name\": \"Cortvriend\"}",
      "organization_id": null
    },
    {
      "name": "Bennett",
      "classification": "primary",
      "entity_type": "person",
      "primary": true,
      "person_id": "~{\"name\": \"Bennett\"}",
      "organization_id": null
    },
    {
      "name": "Boylan",
      "classification": "primary",
      "entity_type": "person",
      "primary": true,
      "person_id": "~{\"name\": \"Boylan\"}",
      "organization_id": null
    },
    {
      "name": "McGaw",
      "classification": "primary",
      "entity_type": "person",
      "primary": true,
      "person_id": "~{\"name\": \"McGaw\"}",
      "organization_id": null
    }
  ],
  "related_bills": [],
  "versions": [
    {
      "note": "5019",
      "links": [
        {
          "url": "http://webserver.rilegislature.gov/BillText/BillText25/HouseText25/H5019.pdf",
          "media_type": "application/pdf"
        }
      ],
      "date": "",
      "classification": ""
    }
  ],
  "documents": [],
  "citations": [],
  "sources": [
    {
      "url": "https://status.rilegislature.gov/",
      "note": ""
    }
  ],
  "extras": {},
  "jurisdiction": {
    "id": "ocd-jurisdiction/country:us/state:ri/government",
    "name": "Rhode Island",
    "classification": "state",
    "division_id": "ocd-division/country:us/state:ri"
  },
  "_processing": {
    "logs_latest_update": "2025-11-26T03:04:57Z"
  }
}