{
  "legislative_session": "2025",
  "identifier": "SB397",
  "title": "AN ACT RELATING TO MOTOR AND OTHER VEHICLES -- OPERATORS' AND CHAUFFEURS' LICENSES",
  "from_organization": "~{\"classification\": \"upper\"}",
  "classification": [
    "bill"
  ],
  "subject": [],
  "abstracts": [
    {
      "note": "summary",
      "abstract": "Reduces the course time required to become a school bus driver for applicants who have a valid commercial driver\u2019s license."
    }
  ],
  "other_titles": [],
  "other_identifiers": [],
  "actions": [
    {
      "description": "02/26/2025 Introduced, referred to Senate Education",
      "date": "2025-02-26",
      "organization_id": "~{\"classification\": \"upper\"}",
      "classification": [
        "introduction",
        "referral-committee"
      ],
      "related_entities": [],
      "_processing": {
        "log_file_created": "2025-11-26T03:05:04Z"
      }
    },
    {
      "description": "03/28/2025 Scheduled for hearing and/or consideration  (04/02/2025)",
      "date": "2025-03-28",
      "organization_id": "~{\"classification\": \"legislature\"}",
      "classification": [],
      "related_entities": [],
      "_processing": {
        "log_file_created": "2025-11-26T03:05:04Z"
      }
    },
    {
      "description": "04/02/2025 Committee recommended measure be held for further study",
      "date": "2025-04-02",
      "organization_id": "~{\"classification\": \"legislature\"}",
      "classification": [
        "committee-failure"
      ],
      "related_entities": [],
      "_processing": {
        "log_file_created": "2025-11-26T03:05:04Z"
      }
    },
    {
      "description": "04/18/2025 Scheduled for consideration",
      "date": "2025-04-18",
      "organization_id": "~{\"classification\": \"legislature\"}",
      "classification": [],
      "related_entities": [],
      "_processing": {
        "log_file_created": "2025-11-26T03:05:04Z"
      }
    },
    {
      "description": "04/21/2025 Meeting postponed  (04/23/2025)",
      "date": "2025-04-21",
      "organization_id": "~{\"classification\": \"legislature\"}",
      "classification": [],
      "related_entities": [],
      "_processing": {
        "log_file_created": "2025-11-26T03:05:04Z"
      }
    },
    {
      "description": "04/25/2025 Scheduled for consideration  (04/30/2025)",
      "date": "2025-04-25",
      "organization_id": "~{\"classification\": \"legislature\"}",
      "classification": [],
      "related_entities": [],
      "_processing": {
        "log_file_created": "2025-11-26T03:05:04Z"
      }
    },
    {
      "description": "04/29/2025 Proposed Substitute",
      "date": "2025-04-29",
      "organization_id": "~{\"classification\": \"legislature\"}",
      "classification": [
        "substitution"
      ],
      "related_entities": [],
      "_processing": {
        "log_file_created": "2025-11-26T03:05:04Z"
      }
    },
    {
      "description": "04/30/2025 Committee recommends passage of Sub A",
      "date": "2025-04-30",
      "organization_id": "~{\"classification\": \"legislature\"}",
      "classification": [
        "committee-passage-favorable"
      ],
      "related_entities": [],
      "_processing": {
        "log_file_created": "2025-11-26T03:05:04Z"
      }
    },
    {
      "description": "05/01/2025 Placed on Senate Calendar  (05/06/2025)",
      "date": "2025-05-01",
      "organization_id": "~{\"classification\": \"upper\"}",
      "classification": [
        "reading-3"
      ],
      "related_entities": [],
      "_processing": {
        "log_file_created": "2025-11-26T03:05:04Z"
      }
    },
    {
      "description": "05/06/2025 Senate passed Sub A as amended (floor amendment)",
      "date": "2025-05-06",
      "organization_id": "~{\"classification\": \"upper\"}",
      "classification": [
        "passage"
      ],
      "related_entities": [],
      "_processing": {
        "log_file_created": "2025-11-26T03:05:04Z"
      }
    },
    {
      "description": "05/07/2025 Referred to House State Government & Elections",
      "date": "2025-05-07",
      "organization_id": "~{\"classification\": \"lower\"}",
      "classification": [
        "referral-committee"
      ],
      "related_entities": [],
      "_processing": {
        "log_file_created": "2025-11-26T03:05:04Z"
      }
    },
    {
      "description": "05/30/2025 Scheduled for consideration  (06/03/2025)",
      "date": "2025-05-30",
      "organization_id": "~{\"classification\": \"legislature\"}",
      "classification": [],
      "related_entities": [],
      "_processing": {
        "log_file_created": "2025-11-26T03:05:04Z"
      }
    },
    {
      "description": "06/03/2025 Committee recommends passage of Sub A as amended in concurrence",
      "date": "2025-06-03",
      "organization_id": "~{\"classification\": \"legislature\"}",
      "classification": [
        "committee-passage-favorable"
      ],
      "related_entities": [],
      "_processing": {
        "log_file_created": "2025-11-26T03:05:04Z"
      }
    },
    {
      "description": "06/06/2025 Placed on the House Consent Calendar  (06/10/2025)",
      "date": "2025-06-06",
      "organization_id": "~{\"classification\": \"lower\"}",
      "classification": [
        "reading-3"
      ],
      "related_entities": [],
      "_processing": {
        "log_file_created": "2025-11-26T03:05:04Z"
      }
    },
    {
      "description": "06/10/2025 House passed Sub A as amended in concurrence",
      "date": "2025-06-10",
      "organization_id": "~{\"classification\": \"lower\"}",
      "classification": [
        "passage"
      ],
      "related_entities": [],
      "_processing": {
        "log_file_created": "2025-11-26T03:05:04Z"
      }
    },
    {
      "description": "06/10/2025 Transmitted to Governor",
      "date": "2025-06-10",
      "organization_id": "~{\"classification\": \"executive\"}",
      "classification": [
        "executive-receipt"
      ],
      "related_entities": [],
      "_processing": {
        "log_file_created": "2025-11-26T03:05:04Z"
      }
    },
    {
      "description": "06/13/2025 Signed by Governor",
      "date": "2025-06-13",
      "organization_id": "~{\"classification\": \"executive\"}",
      "classification": [
        "executive-signature"
      ],
      "related_entities": [],
      "_processing": {
        "log_file_created": "2025-11-26T03:05:04Z"
      }
    }
  ],
  "sponsorships": [
    {
      "name": "Ujifusa",
      "classification": "primary",
      "entity_type": "person",
      "primary": true,
      "person_id": "~{\"name\": \"Ujifusa\"}",
      "organization_id": null
    },
    {
      "name": "Zurier",
      "classification": "primary",
      "entity_type": "person",
      "primary": true,
      "person_id": "~{\"name\": \"Zurier\"}",
      "organization_id": null
    },
    {
      "name": "de la Cruz",
      "classification": "primary",
      "entity_type": "person",
      "primary": true,
      "person_id": "~{\"name\": \"de la Cruz\"}",
      "organization_id": null
    }
  ],
  "related_bills": [],
  "versions": [
    {
      "note": "397\u00a0 SUB A\u00a0as amended",
      "links": [
        {
          "url": "http://webserver.rilegislature.gov/BillText/BillText25/SenateText25/S0397Aaa.pdf",
          "media_type": "application/pdf"
        }
      ],
      "date": "",
      "classification": ""
    }
  ],
  "documents": [],
  "citations": [],
  "sources": [
    {
      "url": "https://status.rilegislature.gov/",
      "note": ""
    }
  ],
  "extras": {},
  "jurisdiction": {
    "id": "ocd-jurisdiction/country:us/state:ri/government",
    "name": "Rhode Island",
    "classification": "state",
    "division_id": "ocd-division/country:us/state:ri"
  },
  "_processing": {
    "logs_latest_update": "2025-11-26T03:05:04Z"
  }
}