{
  "legislative_session": "2025",
  "identifier": "SB473",
  "title": "AN ACT RELATING TO INSURANCE -- ACCIDENT AND SICKNESS INSURANCE POLICIES",
  "from_organization": "~{\"classification\": \"upper\"}",
  "classification": [
    "bill"
  ],
  "subject": [],
  "abstracts": [
    {
      "note": "summary",
      "abstract": "Extends coverage for treatment of pediatric autoimmune neuropsychiatric disorders associated with streptococcal infections and pediatric acute onset neuropsychiatric syndrome by removing the sunset date of December 31, 2025, and mandating such coverage."
    }
  ],
  "other_titles": [],
  "other_identifiers": [],
  "actions": [
    {
      "description": "02/26/2025 Introduced, referred to Senate Health and Human Services",
      "date": "2025-02-26",
      "organization_id": "~{\"classification\": \"upper\"}",
      "classification": [
        "introduction",
        "referral-committee"
      ],
      "related_entities": [],
      "_processing": {
        "log_file_created": "2025-11-26T03:05:00Z"
      }
    },
    {
      "description": "03/07/2025 Scheduled for hearing and/or consideration  (03/11/2025)",
      "date": "2025-03-07",
      "organization_id": "~{\"classification\": \"legislature\"}",
      "classification": [],
      "related_entities": [],
      "_processing": {
        "log_file_created": "2025-11-26T03:05:00Z"
      }
    },
    {
      "description": "03/11/2025 Committee recommends passage",
      "date": "2025-03-11",
      "organization_id": "~{\"classification\": \"legislature\"}",
      "classification": [
        "committee-passage-favorable"
      ],
      "related_entities": [],
      "_processing": {
        "log_file_created": "2025-11-26T03:05:00Z"
      }
    },
    {
      "description": "03/12/2025 Placed on Senate Calendar  (03/20/2025)",
      "date": "2025-03-12",
      "organization_id": "~{\"classification\": \"upper\"}",
      "classification": [
        "reading-3"
      ],
      "related_entities": [],
      "_processing": {
        "log_file_created": "2025-11-26T03:05:00Z"
      }
    },
    {
      "description": "03/20/2025 Senate read and passed",
      "date": "2025-03-20",
      "organization_id": "~{\"classification\": \"upper\"}",
      "classification": [
        "passage"
      ],
      "related_entities": [],
      "_processing": {
        "log_file_created": "2025-11-26T03:05:00Z"
      }
    },
    {
      "description": "03/21/2025 Referred to House Health & Human Services",
      "date": "2025-03-21",
      "organization_id": "~{\"classification\": \"lower\"}",
      "classification": [
        "referral-committee"
      ],
      "related_entities": [],
      "_processing": {
        "log_file_created": "2025-11-26T03:05:00Z"
      }
    },
    {
      "description": "06/13/2025 Scheduled for consideration  (06/16/2025)",
      "date": "2025-06-13",
      "organization_id": "~{\"classification\": \"legislature\"}",
      "classification": [],
      "related_entities": [],
      "_processing": {
        "log_file_created": "2025-11-26T03:05:00Z"
      }
    },
    {
      "description": "06/16/2025 Committee recommends passage in concurrence",
      "date": "2025-06-16",
      "organization_id": "~{\"classification\": \"legislature\"}",
      "classification": [
        "committee-passage-favorable"
      ],
      "related_entities": [],
      "_processing": {
        "log_file_created": "2025-11-26T03:05:00Z"
      }
    },
    {
      "description": "06/18/2025 Placed on House Calendar  (06/20/2025)",
      "date": "2025-06-18",
      "organization_id": "~{\"classification\": \"lower\"}",
      "classification": [
        "reading-3"
      ],
      "related_entities": [],
      "_processing": {
        "log_file_created": "2025-11-26T03:05:00Z"
      }
    },
    {
      "description": "06/20/2025 House passed in concurrence",
      "date": "2025-06-20",
      "organization_id": "~{\"classification\": \"lower\"}",
      "classification": [
        "passage"
      ],
      "related_entities": [],
      "_processing": {
        "log_file_created": "2025-11-26T03:05:00Z"
      }
    },
    {
      "description": "06/23/2025 Transmitted to Governor",
      "date": "2025-06-23",
      "organization_id": "~{\"classification\": \"executive\"}",
      "classification": [
        "executive-receipt"
      ],
      "related_entities": [],
      "_processing": {
        "log_file_created": "2025-11-26T03:05:00Z"
      }
    },
    {
      "description": "06/27/2025 Signed by Governor",
      "date": "2025-06-27",
      "organization_id": "~{\"classification\": \"executive\"}",
      "classification": [
        "executive-signature"
      ],
      "related_entities": [],
      "_processing": {
        "log_file_created": "2025-11-26T03:05:00Z"
      }
    }
  ],
  "sponsorships": [
    {
      "name": "Lawson",
      "classification": "primary",
      "entity_type": "person",
      "primary": true,
      "person_id": "~{\"name\": \"Lawson\"}",
      "organization_id": null
    },
    {
      "name": "Lauria",
      "classification": "primary",
      "entity_type": "person",
      "primary": true,
      "person_id": "~{\"name\": \"Lauria\"}",
      "organization_id": null
    },
    {
      "name": "Murray",
      "classification": "primary",
      "entity_type": "person",
      "primary": true,
      "person_id": "~{\"name\": \"Murray\"}",
      "organization_id": null
    },
    {
      "name": "Sosnowski",
      "classification": "primary",
      "entity_type": "person",
      "primary": true,
      "person_id": "~{\"name\": \"Sosnowski\"}",
      "organization_id": null
    },
    {
      "name": "Britto",
      "classification": "primary",
      "entity_type": "person",
      "primary": true,
      "person_id": "~{\"name\": \"Britto\"}",
      "organization_id": null
    },
    {
      "name": "DiMario",
      "classification": "primary",
      "entity_type": "person",
      "primary": true,
      "person_id": "~{\"name\": \"DiMario\"}",
      "organization_id": null
    },
    {
      "name": "Valverde",
      "classification": "primary",
      "entity_type": "person",
      "primary": true,
      "person_id": "~{\"name\": \"Valverde\"}",
      "organization_id": null
    }
  ],
  "related_bills": [],
  "versions": [
    {
      "note": "473",
      "links": [
        {
          "url": "http://webserver.rilegislature.gov/BillText/BillText25/SenateText25/S0473.pdf",
          "media_type": "application/pdf"
        }
      ],
      "date": "",
      "classification": ""
    }
  ],
  "documents": [],
  "citations": [],
  "sources": [
    {
      "url": "https://status.rilegislature.gov/",
      "note": ""
    }
  ],
  "extras": {},
  "jurisdiction": {
    "id": "ocd-jurisdiction/country:us/state:ri/government",
    "name": "Rhode Island",
    "classification": "state",
    "division_id": "ocd-division/country:us/state:ri"
  },
  "_processing": {
    "logs_latest_update": "2025-11-26T03:05:00Z"
  }
}