{
  "legislative_session": "2025",
  "identifier": "SB173",
  "title": "AN ACT RELATING TO STATE AFFAIRS AND GOVERNMENT -- OFFICE OF HEALTH AND HUMAN SERVICES",
  "from_organization": "~{\"classification\": \"upper\"}",
  "classification": [
    "bill"
  ],
  "subject": [],
  "abstracts": [
    {
      "note": "summary",
      "abstract": "Requires the secretary of the executive office of health and human services to monitor and mandate changes to the price-setting practices of pharmacy benefit managers to prohibit the spread pricing payment model."
    }
  ],
  "other_titles": [],
  "other_identifiers": [],
  "actions": [
    {
      "description": "02/05/2025 Introduced, referred to Senate Health and Human Services",
      "date": "2025-02-05",
      "organization_id": "~{\"classification\": \"upper\"}",
      "classification": [
        "introduction",
        "referral-committee"
      ],
      "related_entities": [],
      "_processing": {
        "log_file_created": "2025-11-26T03:05:03Z"
      }
    },
    {
      "description": "03/14/2025 Scheduled for hearing and/or consideration  (03/20/2025)",
      "date": "2025-03-14",
      "organization_id": "~{\"classification\": \"legislature\"}",
      "classification": [],
      "related_entities": [],
      "_processing": {
        "log_file_created": "2025-11-26T03:05:03Z"
      }
    },
    {
      "description": "03/20/2025 Committee recommended measure be held for further study",
      "date": "2025-03-20",
      "organization_id": "~{\"classification\": \"legislature\"}",
      "classification": [
        "committee-failure"
      ],
      "related_entities": [],
      "_processing": {
        "log_file_created": "2025-11-26T03:05:03Z"
      }
    },
    {
      "description": "04/18/2025 Scheduled for consideration",
      "date": "2025-04-18",
      "organization_id": "~{\"classification\": \"legislature\"}",
      "classification": [],
      "related_entities": [],
      "_processing": {
        "log_file_created": "2025-11-26T03:05:03Z"
      }
    },
    {
      "description": "04/21/2025 Meeting postponed  (04/22/2025)",
      "date": "2025-04-21",
      "organization_id": "~{\"classification\": \"legislature\"}",
      "classification": [],
      "related_entities": [],
      "_processing": {
        "log_file_created": "2025-11-26T03:05:03Z"
      }
    },
    {
      "description": "04/29/2025 Scheduled for consideration  (05/01/2025)",
      "date": "2025-04-29",
      "organization_id": "~{\"classification\": \"legislature\"}",
      "classification": [],
      "related_entities": [],
      "_processing": {
        "log_file_created": "2025-11-26T03:05:03Z"
      }
    },
    {
      "description": "05/01/2025 Committee recommends passage",
      "date": "2025-05-01",
      "organization_id": "~{\"classification\": \"legislature\"}",
      "classification": [
        "committee-passage-favorable"
      ],
      "related_entities": [],
      "_processing": {
        "log_file_created": "2025-11-26T03:05:03Z"
      }
    },
    {
      "description": "05/02/2025 Placed on Senate Calendar  (05/06/2025)",
      "date": "2025-05-02",
      "organization_id": "~{\"classification\": \"upper\"}",
      "classification": [
        "reading-3"
      ],
      "related_entities": [],
      "_processing": {
        "log_file_created": "2025-11-26T03:05:03Z"
      }
    },
    {
      "description": "05/06/2025 Senate read and passed",
      "date": "2025-05-06",
      "organization_id": "~{\"classification\": \"upper\"}",
      "classification": [
        "passage"
      ],
      "related_entities": [],
      "_processing": {
        "log_file_created": "2025-11-26T03:05:03Z"
      }
    },
    {
      "description": "05/07/2025 Referred to House Health & Human Services",
      "date": "2025-05-07",
      "organization_id": "~{\"classification\": \"lower\"}",
      "classification": [
        "referral-committee"
      ],
      "related_entities": [],
      "_processing": {
        "log_file_created": "2025-11-26T03:05:03Z"
      }
    }
  ],
  "sponsorships": [
    {
      "name": "Ujifusa",
      "classification": "primary",
      "entity_type": "person",
      "primary": true,
      "person_id": "~{\"name\": \"Ujifusa\"}",
      "organization_id": null
    },
    {
      "name": "Ruggerio",
      "classification": "primary",
      "entity_type": "person",
      "primary": true,
      "person_id": "~{\"name\": \"Ruggerio\"}",
      "organization_id": null
    },
    {
      "name": "Lawson",
      "classification": "primary",
      "entity_type": "person",
      "primary": true,
      "person_id": "~{\"name\": \"Lawson\"}",
      "organization_id": null
    },
    {
      "name": "Tikoian",
      "classification": "primary",
      "entity_type": "person",
      "primary": true,
      "person_id": "~{\"name\": \"Tikoian\"}",
      "organization_id": null
    }
  ],
  "related_bills": [],
  "versions": [
    {
      "note": "173",
      "links": [
        {
          "url": "http://webserver.rilegislature.gov/BillText/BillText25/SenateText25/S0173.pdf",
          "media_type": "application/pdf"
        }
      ],
      "date": "",
      "classification": ""
    }
  ],
  "documents": [],
  "citations": [],
  "sources": [
    {
      "url": "https://status.rilegislature.gov/",
      "note": ""
    }
  ],
  "extras": {},
  "jurisdiction": {
    "id": "ocd-jurisdiction/country:us/state:ri/government",
    "name": "Rhode Island",
    "classification": "state",
    "division_id": "ocd-division/country:us/state:ri"
  },
  "_processing": {
    "logs_latest_update": "2025-11-26T03:05:03Z"
  }
}