{
  "legislative_session": "2025",
  "identifier": "SB756",
  "title": "AN ACT RELATING TO ALCOHOLIC BEVERAGES -- RETAIL LICENSES",
  "from_organization": "~{\"classification\": \"upper\"}",
  "classification": [
    "bill"
  ],
  "subject": [],
  "abstracts": [
    {
      "note": "summary",
      "abstract": "Allows for the issuance of a Class BV liquor license for the property located at 865 Westminster Street in the city of Providence."
    }
  ],
  "other_titles": [],
  "other_identifiers": [],
  "actions": [
    {
      "description": "03/07/2025 Introduced, referred to Senate Special Legislation and Veterans Affairs",
      "date": "2025-03-07",
      "organization_id": "~{\"classification\": \"upper\"}",
      "classification": [
        "introduction",
        "referral-committee"
      ],
      "related_entities": [],
      "_processing": {
        "log_file_created": "2025-11-26T03:04:59Z"
      }
    },
    {
      "description": "04/04/2025 Scheduled for hearing and/or consideration  (04/09/2025)",
      "date": "2025-04-04",
      "organization_id": "~{\"classification\": \"legislature\"}",
      "classification": [],
      "related_entities": [],
      "_processing": {
        "log_file_created": "2025-11-26T03:04:59Z"
      }
    },
    {
      "description": "04/09/2025 Committee recommended measure be held for further study",
      "date": "2025-04-09",
      "organization_id": "~{\"classification\": \"legislature\"}",
      "classification": [
        "committee-failure"
      ],
      "related_entities": [],
      "_processing": {
        "log_file_created": "2025-11-26T03:04:59Z"
      }
    },
    {
      "description": "04/18/2025 Scheduled for consideration",
      "date": "2025-04-18",
      "organization_id": "~{\"classification\": \"legislature\"}",
      "classification": [],
      "related_entities": [],
      "_processing": {
        "log_file_created": "2025-11-26T03:04:59Z"
      }
    },
    {
      "description": "04/21/2025 Meeting postponed  (04/23/2025)",
      "date": "2025-04-21",
      "organization_id": "~{\"classification\": \"legislature\"}",
      "classification": [],
      "related_entities": [],
      "_processing": {
        "log_file_created": "2025-11-26T03:04:59Z"
      }
    },
    {
      "description": "04/25/2025 Scheduled for consideration  (04/30/2025)",
      "date": "2025-04-25",
      "organization_id": "~{\"classification\": \"legislature\"}",
      "classification": [],
      "related_entities": [],
      "_processing": {
        "log_file_created": "2025-11-26T03:04:59Z"
      }
    },
    {
      "description": "04/30/2025 Committee recommends passage",
      "date": "2025-04-30",
      "organization_id": "~{\"classification\": \"legislature\"}",
      "classification": [
        "committee-passage-favorable"
      ],
      "related_entities": [],
      "_processing": {
        "log_file_created": "2025-11-26T03:04:59Z"
      }
    },
    {
      "description": "05/01/2025 Placed on Senate Calendar  (05/06/2025)",
      "date": "2025-05-01",
      "organization_id": "~{\"classification\": \"upper\"}",
      "classification": [
        "reading-3"
      ],
      "related_entities": [],
      "_processing": {
        "log_file_created": "2025-11-26T03:04:59Z"
      }
    },
    {
      "description": "05/06/2025 Senate read and passed",
      "date": "2025-05-06",
      "organization_id": "~{\"classification\": \"upper\"}",
      "classification": [
        "passage"
      ],
      "related_entities": [],
      "_processing": {
        "log_file_created": "2025-11-26T03:04:59Z"
      }
    },
    {
      "description": "05/07/2025 Referred to House Municipal Government & Housing",
      "date": "2025-05-07",
      "organization_id": "~{\"classification\": \"lower\"}",
      "classification": [
        "referral-committee"
      ],
      "related_entities": [],
      "_processing": {
        "log_file_created": "2025-11-26T03:04:59Z"
      }
    },
    {
      "description": "05/30/2025 Scheduled for consideration  (06/04/2025)",
      "date": "2025-05-30",
      "organization_id": "~{\"classification\": \"legislature\"}",
      "classification": [],
      "related_entities": [],
      "_processing": {
        "log_file_created": "2025-11-26T03:04:59Z"
      }
    },
    {
      "description": "06/04/2025 Committee recommends passage in concurrence",
      "date": "2025-06-04",
      "organization_id": "~{\"classification\": \"legislature\"}",
      "classification": [
        "committee-passage-favorable"
      ],
      "related_entities": [],
      "_processing": {
        "log_file_created": "2025-11-26T03:04:59Z"
      }
    },
    {
      "description": "06/13/2025 Placed on the House Consent Calendar  (06/17/2025)",
      "date": "2025-06-13",
      "organization_id": "~{\"classification\": \"lower\"}",
      "classification": [
        "reading-3"
      ],
      "related_entities": [],
      "_processing": {
        "log_file_created": "2025-11-26T03:04:59Z"
      }
    },
    {
      "description": "06/17/2025 House passed in concurrence",
      "date": "2025-06-17",
      "organization_id": "~{\"classification\": \"lower\"}",
      "classification": [
        "passage"
      ],
      "related_entities": [],
      "_processing": {
        "log_file_created": "2025-11-26T03:04:59Z"
      }
    },
    {
      "description": "06/17/2025 Transmitted to Governor",
      "date": "2025-06-17",
      "organization_id": "~{\"classification\": \"executive\"}",
      "classification": [
        "executive-receipt"
      ],
      "related_entities": [],
      "_processing": {
        "log_file_created": "2025-11-26T03:04:59Z"
      }
    },
    {
      "description": "06/25/2025 Effective without Governor's signature",
      "date": "2025-06-25",
      "organization_id": "~{\"classification\": \"executive\"}",
      "classification": [
        "became-law"
      ],
      "related_entities": [],
      "_processing": {
        "log_file_created": "2025-11-26T03:04:59Z"
      }
    }
  ],
  "sponsorships": [
    {
      "name": "Bell",
      "classification": "primary",
      "entity_type": "person",
      "primary": true,
      "person_id": "~{\"name\": \"Bell\"}",
      "organization_id": null
    },
    {
      "name": "Mack",
      "classification": "primary",
      "entity_type": "person",
      "primary": true,
      "person_id": "~{\"name\": \"Mack\"}",
      "organization_id": null
    }
  ],
  "related_bills": [],
  "versions": [
    {
      "note": "756",
      "links": [
        {
          "url": "http://webserver.rilegislature.gov/BillText/BillText25/SenateText25/S0756.pdf",
          "media_type": "application/pdf"
        }
      ],
      "date": "",
      "classification": ""
    }
  ],
  "documents": [],
  "citations": [],
  "sources": [
    {
      "url": "https://status.rilegislature.gov/",
      "note": ""
    }
  ],
  "extras": {},
  "jurisdiction": {
    "id": "ocd-jurisdiction/country:us/state:ri/government",
    "name": "Rhode Island",
    "classification": "state",
    "division_id": "ocd-division/country:us/state:ri"
  },
  "_processing": {
    "logs_latest_update": "2025-11-26T03:04:59Z"
  }
}