{
  "legislative_session": "2025",
  "identifier": "SB636",
  "title": "AN ACT RELATING TO MOTOR AND OTHER VEHICLES -- PUPIL TRANSPORTATION VEHICLES",
  "from_organization": "~{\"classification\": \"upper\"}",
  "classification": [
    "bill"
  ],
  "subject": [],
  "abstracts": [
    {
      "note": "summary",
      "abstract": "Amends the definitions of a \u201cpupil transportation vehicle\u201d to a vehicle contrasted to seat not more than ten (10) passengers plus the operator, rather than the existing limit of eight (8) passengers."
    }
  ],
  "other_titles": [],
  "other_identifiers": [],
  "actions": [
    {
      "description": "03/07/2025 Introduced, referred to Senate Education",
      "date": "2025-03-07",
      "organization_id": "~{\"classification\": \"upper\"}",
      "classification": [
        "introduction",
        "referral-committee"
      ],
      "related_entities": [],
      "_processing": {
        "log_file_created": "2025-11-26T03:04:58Z"
      }
    },
    {
      "description": "03/28/2025 Scheduled for hearing and/or consideration  (04/02/2025)",
      "date": "2025-03-28",
      "organization_id": "~{\"classification\": \"legislature\"}",
      "classification": [],
      "related_entities": [],
      "_processing": {
        "log_file_created": "2025-11-26T03:04:58Z"
      }
    },
    {
      "description": "04/02/2025 Committee recommended measure be held for further study",
      "date": "2025-04-02",
      "organization_id": "~{\"classification\": \"legislature\"}",
      "classification": [
        "committee-failure"
      ],
      "related_entities": [],
      "_processing": {
        "log_file_created": "2025-11-26T03:04:58Z"
      }
    },
    {
      "description": "04/18/2025 Scheduled for consideration",
      "date": "2025-04-18",
      "organization_id": "~{\"classification\": \"legislature\"}",
      "classification": [],
      "related_entities": [],
      "_processing": {
        "log_file_created": "2025-11-26T03:04:58Z"
      }
    },
    {
      "description": "04/21/2025 Meeting postponed  (04/23/2025)",
      "date": "2025-04-21",
      "organization_id": "~{\"classification\": \"legislature\"}",
      "classification": [],
      "related_entities": [],
      "_processing": {
        "log_file_created": "2025-11-26T03:04:58Z"
      }
    },
    {
      "description": "04/25/2025 Scheduled for consideration  (04/30/2025)",
      "date": "2025-04-25",
      "organization_id": "~{\"classification\": \"legislature\"}",
      "classification": [],
      "related_entities": [],
      "_processing": {
        "log_file_created": "2025-11-26T03:04:58Z"
      }
    },
    {
      "description": "04/30/2025 Committee recommends passage",
      "date": "2025-04-30",
      "organization_id": "~{\"classification\": \"legislature\"}",
      "classification": [
        "committee-passage-favorable"
      ],
      "related_entities": [],
      "_processing": {
        "log_file_created": "2025-11-26T03:04:58Z"
      }
    },
    {
      "description": "05/01/2025 Placed on Senate Calendar  (05/06/2025)",
      "date": "2025-05-01",
      "organization_id": "~{\"classification\": \"upper\"}",
      "classification": [
        "reading-3"
      ],
      "related_entities": [],
      "_processing": {
        "log_file_created": "2025-11-26T03:04:58Z"
      }
    },
    {
      "description": "05/06/2025 Senate read and passed",
      "date": "2025-05-06",
      "organization_id": "~{\"classification\": \"upper\"}",
      "classification": [
        "passage"
      ],
      "related_entities": [],
      "_processing": {
        "log_file_created": "2025-11-26T03:04:58Z"
      }
    },
    {
      "description": "05/07/2025 Referred to House Education",
      "date": "2025-05-07",
      "organization_id": "~{\"classification\": \"lower\"}",
      "classification": [
        "referral-committee"
      ],
      "related_entities": [],
      "_processing": {
        "log_file_created": "2025-11-26T03:04:58Z"
      }
    },
    {
      "description": "05/25/2025 Scheduled for consideration  (05/27/2025)",
      "date": "2025-05-25",
      "organization_id": "~{\"classification\": \"legislature\"}",
      "classification": [],
      "related_entities": [],
      "_processing": {
        "log_file_created": "2025-11-26T03:04:58Z"
      }
    },
    {
      "description": "05/27/2025 Committee recommends passage in concurrence",
      "date": "2025-05-27",
      "organization_id": "~{\"classification\": \"legislature\"}",
      "classification": [
        "committee-passage-favorable"
      ],
      "related_entities": [],
      "_processing": {
        "log_file_created": "2025-11-26T03:04:58Z"
      }
    },
    {
      "description": "06/13/2025 Placed on the House Consent Calendar  (06/17/2025)",
      "date": "2025-06-13",
      "organization_id": "~{\"classification\": \"lower\"}",
      "classification": [
        "reading-3"
      ],
      "related_entities": [],
      "_processing": {
        "log_file_created": "2025-11-26T03:04:58Z"
      }
    },
    {
      "description": "06/17/2025 House passed in concurrence",
      "date": "2025-06-17",
      "organization_id": "~{\"classification\": \"lower\"}",
      "classification": [
        "passage"
      ],
      "related_entities": [],
      "_processing": {
        "log_file_created": "2025-11-26T03:04:58Z"
      }
    },
    {
      "description": "06/17/2025 Transmitted to Governor",
      "date": "2025-06-17",
      "organization_id": "~{\"classification\": \"executive\"}",
      "classification": [
        "executive-receipt"
      ],
      "related_entities": [],
      "_processing": {
        "log_file_created": "2025-11-26T03:04:58Z"
      }
    },
    {
      "description": "06/23/2025 Signed by Governor",
      "date": "2025-06-23",
      "organization_id": "~{\"classification\": \"executive\"}",
      "classification": [
        "executive-signature"
      ],
      "related_entities": [],
      "_processing": {
        "log_file_created": "2025-11-26T03:04:58Z"
      }
    }
  ],
  "sponsorships": [
    {
      "name": "Ujifusa",
      "classification": "primary",
      "entity_type": "person",
      "primary": true,
      "person_id": "~{\"name\": \"Ujifusa\"}",
      "organization_id": null
    },
    {
      "name": "Murray",
      "classification": "primary",
      "entity_type": "person",
      "primary": true,
      "person_id": "~{\"name\": \"Murray\"}",
      "organization_id": null
    },
    {
      "name": "de la Cruz",
      "classification": "primary",
      "entity_type": "person",
      "primary": true,
      "person_id": "~{\"name\": \"de la Cruz\"}",
      "organization_id": null
    },
    {
      "name": "DiPalma",
      "classification": "primary",
      "entity_type": "person",
      "primary": true,
      "person_id": "~{\"name\": \"DiPalma\"}",
      "organization_id": null
    },
    {
      "name": "Mack",
      "classification": "primary",
      "entity_type": "person",
      "primary": true,
      "person_id": "~{\"name\": \"Mack\"}",
      "organization_id": null
    },
    {
      "name": "McKenney",
      "classification": "primary",
      "entity_type": "person",
      "primary": true,
      "person_id": "~{\"name\": \"McKenney\"}",
      "organization_id": null
    },
    {
      "name": "Gallo",
      "classification": "primary",
      "entity_type": "person",
      "primary": true,
      "person_id": "~{\"name\": \"Gallo\"}",
      "organization_id": null
    },
    {
      "name": "Zurier",
      "classification": "primary",
      "entity_type": "person",
      "primary": true,
      "person_id": "~{\"name\": \"Zurier\"}",
      "organization_id": null
    },
    {
      "name": "LaMountain",
      "classification": "primary",
      "entity_type": "person",
      "primary": true,
      "person_id": "~{\"name\": \"LaMountain\"}",
      "organization_id": null
    },
    {
      "name": "DiMario",
      "classification": "primary",
      "entity_type": "person",
      "primary": true,
      "person_id": "~{\"name\": \"DiMario\"}",
      "organization_id": null
    }
  ],
  "related_bills": [],
  "versions": [
    {
      "note": "636",
      "links": [
        {
          "url": "http://webserver.rilegislature.gov/BillText/BillText25/SenateText25/S0636.pdf",
          "media_type": "application/pdf"
        }
      ],
      "date": "",
      "classification": ""
    }
  ],
  "documents": [],
  "citations": [],
  "sources": [
    {
      "url": "https://status.rilegislature.gov/",
      "note": ""
    }
  ],
  "extras": {},
  "jurisdiction": {
    "id": "ocd-jurisdiction/country:us/state:ri/government",
    "name": "Rhode Island",
    "classification": "state",
    "division_id": "ocd-division/country:us/state:ri"
  },
  "_processing": {
    "logs_latest_update": "2025-11-26T03:04:58Z"
  }
}