{
  "legislative_session": "2025",
  "identifier": "HB6091",
  "title": "AN ACT RELATING TO ALCOHOLIC BEVERAGES -- RETAIL LICENSES-CENTRAL FALLS",
  "from_organization": "~{\"classification\": \"lower\"}",
  "classification": [
    "bill"
  ],
  "subject": [],
  "abstracts": [
    {
      "note": "summary",
      "abstract": "Allows Central Falls to exempt the property located at 913-915 Dexter Street, AP 7, Lot 156 from the law that prohibits any proposed retailers\u2019 license of any class located within two hundred feet (200') of the premises of a school or place of worship."
    }
  ],
  "other_titles": [],
  "other_identifiers": [],
  "actions": [
    {
      "description": "03/14/2025 Introduced, referred to House Municipal Government & Housing",
      "date": "2025-03-14",
      "organization_id": "~{\"classification\": \"lower\"}",
      "classification": [
        "introduction",
        "referral-committee"
      ],
      "related_entities": [],
      "_processing": {
        "log_file_created": "2025-11-26T03:05:01Z"
      }
    },
    {
      "description": "04/04/2025 Scheduled for hearing and/or consideration  (04/10/2025)",
      "date": "2025-04-04",
      "organization_id": "~{\"classification\": \"legislature\"}",
      "classification": [],
      "related_entities": [],
      "_processing": {
        "log_file_created": "2025-11-26T03:05:01Z"
      }
    },
    {
      "description": "04/10/2025 Committee recommended measure be held for further study",
      "date": "2025-04-10",
      "organization_id": "~{\"classification\": \"legislature\"}",
      "classification": [
        "committee-failure"
      ],
      "related_entities": [],
      "_processing": {
        "log_file_created": "2025-11-26T03:05:01Z"
      }
    },
    {
      "description": "05/30/2025 Scheduled for consideration  (06/04/2025)",
      "date": "2025-05-30",
      "organization_id": "~{\"classification\": \"legislature\"}",
      "classification": [],
      "related_entities": [],
      "_processing": {
        "log_file_created": "2025-11-26T03:05:01Z"
      }
    },
    {
      "description": "06/04/2025 Committee recommends passage",
      "date": "2025-06-04",
      "organization_id": "~{\"classification\": \"legislature\"}",
      "classification": [
        "committee-passage-favorable"
      ],
      "related_entities": [],
      "_processing": {
        "log_file_created": "2025-11-26T03:05:01Z"
      }
    },
    {
      "description": "06/06/2025 Placed on House Calendar  (06/12/2025)",
      "date": "2025-06-06",
      "organization_id": "~{\"classification\": \"lower\"}",
      "classification": [
        "reading-3"
      ],
      "related_entities": [],
      "_processing": {
        "log_file_created": "2025-11-26T03:05:01Z"
      }
    },
    {
      "description": "06/12/2025 House read and passed",
      "date": "2025-06-12",
      "organization_id": "~{\"classification\": \"lower\"}",
      "classification": [
        "passage"
      ],
      "related_entities": [],
      "_processing": {
        "log_file_created": "2025-11-26T03:05:01Z"
      }
    },
    {
      "description": "06/18/2025 Placed on Senate Calendar  (06/20/2025)",
      "date": "2025-06-18",
      "organization_id": "~{\"classification\": \"upper\"}",
      "classification": [
        "reading-3"
      ],
      "related_entities": [],
      "_processing": {
        "log_file_created": "2025-11-26T03:05:01Z"
      }
    },
    {
      "description": "06/21/2025 Senate passed in concurrence",
      "date": "2025-06-21",
      "organization_id": "~{\"classification\": \"upper\"}",
      "classification": [
        "passage"
      ],
      "related_entities": [],
      "_processing": {
        "log_file_created": "2025-11-26T03:05:01Z"
      }
    },
    {
      "description": "06/27/2025 Transmitted to Governor",
      "date": "2025-06-27",
      "organization_id": "~{\"classification\": \"executive\"}",
      "classification": [
        "executive-receipt"
      ],
      "related_entities": [],
      "_processing": {
        "log_file_created": "2025-11-26T03:05:01Z"
      }
    },
    {
      "description": "07/05/2025 Effective without Governor's signature",
      "date": "2025-07-05",
      "organization_id": "~{\"classification\": \"executive\"}",
      "classification": [
        "became-law"
      ],
      "related_entities": [],
      "_processing": {
        "log_file_created": "2025-11-26T03:05:01Z"
      }
    }
  ],
  "sponsorships": [
    {
      "name": "Giraldo",
      "classification": "primary",
      "entity_type": "person",
      "primary": true,
      "person_id": "~{\"name\": \"Giraldo\"}",
      "organization_id": null
    },
    {
      "name": "Alzate",
      "classification": "primary",
      "entity_type": "person",
      "primary": true,
      "person_id": "~{\"name\": \"Alzate\"}",
      "organization_id": null
    },
    {
      "name": "Voas",
      "classification": "primary",
      "entity_type": "person",
      "primary": true,
      "person_id": "~{\"name\": \"Voas\"}",
      "organization_id": null
    }
  ],
  "related_bills": [],
  "versions": [
    {
      "note": "6091",
      "links": [
        {
          "url": "http://webserver.rilegislature.gov/BillText/BillText25/HouseText25/H6091.pdf",
          "media_type": "application/pdf"
        }
      ],
      "date": "",
      "classification": ""
    }
  ],
  "documents": [],
  "citations": [],
  "sources": [
    {
      "url": "https://status.rilegislature.gov/",
      "note": ""
    }
  ],
  "extras": {},
  "jurisdiction": {
    "id": "ocd-jurisdiction/country:us/state:ri/government",
    "name": "Rhode Island",
    "classification": "state",
    "division_id": "ocd-division/country:us/state:ri"
  },
  "_processing": {
    "logs_latest_update": "2025-11-26T03:05:01Z"
  }
}